,Usuario,Nombre,Fecha,Tweet,RT,like,path,verificados
397,@ljcoffaro,Leslie Coffaro,8 jul. 2017,"1. Since MSM is fear based , why don't you scare us with truth about meat, drug, dairy industry, water, GMO's, sugar: watch What the Health!",0,0,/ljcoffaro/status/883528190895026176,
398,@mabdinur85,Mohamed Abdinur,8 jul. 2017,That's the needle that must be thread for it to be successful. I'll keep an open mind. You can't hate GMO but love your medicine.,0,0,/mabdinur85/status/883485165355503621,
399,@itweety58,Itweety58,7 jul. 2017,@SquawkCNBC Glad I listened today. Just learned how naive you are about GMO crops vs Medicine. GMO crops have built-in PESTICIDES. #MAGA,0,0,/itweety58/status/883283830160936960,
400,@Mandokero,MANDO-QUEER ⭐️ 🎄,6 jul. 2017,"Or hell, going back to medicine, try to do an MRI without knowing what Isotopes to use.
Or try and make GMO's without knowing genetics.",0,0,/Mandokero/status/883108000180969472,
401,@kia_vegano,Vegan Kimaya,6 jul. 2017,Also request to GMO company stop developing gmo cannabis you are once again ruining Mother Nature blessed Quantum medicine,1,3,/kia_vegano/status/882845749825880064,
402,@mattybgame,M Ballgame,6 jul. 2017,No #GMO is the gateway drug to #antivax,0,1,/mattybgame/status/882779294820294657,
403,@wpwend,William Patrick Wend,4 jul. 2017,"If only they'd talk about the tobacco industry, or how GMO's give you cancer, or racist drug laws....but nah that isn't xEDGEx enough",0,0,/wpwend/status/882352090194071552,
404,@thecolormage,🛋BERNARD,4 jul. 2017,Whatever you blame on others. You blame on yourself. Tough medicine I know. It contains no sugar or gmo ingredients. It's raw. Tangy.,0,0,/thecolormage/status/882253458627117056,
405,@NMedicineB,Natural Medicine Box,3 jul. 2017,"http://www.naturalmedicinebox.net/without-saying-a-word-this-short-6-minute-video-will-leave-you-speechless/ …
Video Will Leave You Speechless
#Food #foodforthought #chicken #Health #Healthcare #GMO #meat #medicine pic.twitter.com/qWQxiQESlW",0,0,/NMedicineB/status/881909825545940992,
406,@tomekirk,AuldShare:OneEarth,2 jul. 2017,"Corporate profits depend on customers sick/addicted/enslaved to product
GMO impairment
Pharma drug maintenance
Take back food/health/life",0,0,/tomekirk/status/881504900630315008,
407,@DougJanack,Doug Janack,1 jul. 2017,"Isn't leftist anti-science generally anti-capitalist? E.g. traditional medicine is bad because ""Big Pharma"", GMO is bad because Monsanto 1/2",0,0,/DougJanack/status/881244512898752513,
408,@terry7531,terry,30 jun. 2017,Real food is the best medicine there is. Food-like products and gmo are death by slow poison! pic.twitter.com/3tDOZgqcPI,3,4,/terry7531/status/880643117237452800,
409,@gmo_crops,GMO Crop News,30 jun. 2017,#GMO news: Internal Medicine Physician Launches FoodTherapyMD http://ow.ly/ULb950cuPcv,0,0,/gmo_crops/status/880577524849410049,
410,@ifpa_inc,IFPA,28 jun. 2017,"The FDA, Food and Drug Administration does not mandate the designation GMO on the food labels. https://ifpa-fitness.com/product/gmos-genetically-modified-organisms/ …",0,0,/ifpa_inc/status/880137838842363904,
411,@EssieHabibi,Esmeralda ChiSox,28 jun. 2017,"I am #vegan, but I am also pro-Western medicine b/c I like being alive and pro #GMO b/c I like eating giant fruit in winter.",0,2,/EssieHabibi/status/879938245492080640,
412,@ClarkeHamel,clarke j,25 jun. 2017,"@theJagmeetSingh With a junk food & GMO food culture plus cut-and-drug non-health care, we could really use burial assistance",0,0,/ClarkeHamel/status/879052791213326337,
413,@ghetto_shaman,Truth_Hz,25 jun. 2017,"https://youtu.be/ZAaEjSEnqmc 
How to identify #GMO foods at grocery store.",0,0,/ghetto_shaman/status/878783482960465929,
414,@Sidharthsethi86,Sidharth,24 jun. 2017,please ask him to get some more GMO seeds into our country as the cancer medicine industry is not making as much profit as it wants.,0,0,/Sidharthsethi86/status/878656149586755584,
415,@cavana3,Patricia Cavanaugh,24 jun. 2017,GMO salmon farm called 'drug factory' http://www.cbc.ca/1.1050888,0,0,/cavana3/status/878422185861406720,
416,@gmo_crops,GMO Crop News,24 jun. 2017,#GMO news: International Drug & Explosives Detection Company Identa Corp Hires Internet Marketing Company http://ow.ly/Iv4a50cmQdW,0,0,/gmo_crops/status/878402962674126850,
417,@Gmo_the_Hero,Bush_Did_9/11,23 jun. 2017,The only reason there is a drug problem there is because people in the U.S buy the drugs!,0,0,/Gmo_the_Hero/status/878283945061883904,
418,@Aulstrue,aulstrue,23 jun. 2017,Genetically Modified Humans? New Gene-Altering Drug Paves Way for Mass Modification http://fb.me/4QCJcsvfy,0,0,/Aulstrue/status/878090842421870593,
419,@smsisita,Samantha,23 jun. 2017,"opened a gmo thread just to see someone say they don't trust gmos the way they don't trust some medicine and vaccines
had to leave",0,1,/smsisita/status/878048972543107072,
420,@Itsme060602,Zueri Schnurre,22 jun. 2017,"we are not a 3rd world country, we should be comparable to Europe and we aren't. it's our lifestyle, Obesity, drug use, GMO, Monsanto etc.",0,0,/Itsme060602/status/877969957765566464,
421,@GiantofShire,Red Pilled Soldier,21 jun. 2017,"Always be skeptical of all science based on statistics 
That includes GMO and drug tests.  Maybe,  maybe not.  
Too much reckless science",0,0,/GiantofShire/status/877338997801885698,
422,@LCNaturalHealin,Lily Choi,20 jun. 2017,"gmo_gus
The practices of Ayurveda and Traditional Chinese Medicine (#TCM) are big advocates for… https://www.instagram.com/p/BVkRuwpBSFH/",0,0,/LCNaturalHealin/status/877190161708273666,
423,@Demeter_Designs,Demeter,20 jun. 2017,"Put down your cellphone, your medicine, sell your car, your GMO food, your clocks, your house, your clothes... get rid of it all.",0,0,/Demeter_Designs/status/876958526404411392,
424,@maverick4pa,mark brown,19 jun. 2017,"I think going Organic is critical 4R Oceans+Our Health. Regenerate the 
soil, cool the Earth. Clean up the gmo-AB-pesticide-drug soup.",0,0,/maverick4pa/status/876784371818278912,
425,@SuperDave629,❗️ ⚠️Super Dave ⚠️ ❗️,18 jun. 2017,"Population control is rampant.
GMO's, vaccines, ""medicine"", abortion, Feminism...could keep going on this subject...so I'll stop there...",0,2,/SuperDave629/status/876524815208910848,
426,@_beshay,MB,18 jun. 2017,"Medicine, not GMO's. GMO's were initially made for people to be able to grow crops in places such as Africa where it's hard to grow food",0,0,/_beshay/status/876488981034225668,
427,@MasonUndefined,Mason Heidelman,18 jun. 2017,"Part 3:
The western world is now 100% weaponized; Toxic drinking Water, Food (GMO), Air, Medicine, Television, Music, EMF/RF Frequencies.",0,1,/MasonUndefined/status/876488839484686337,
428,@V4Vendetta007,V,18 jun. 2017,Natural organic cannabis is a great medicine @hellrider1905 @HealthRanger @InventingLee but companies like Bayer will GMO it into a poison,2,5,/V4Vendetta007/status/876393707309846528,
429,@skeptic4ever,Christopher Rand,18 jun. 2017,"Homeopathy, Acupenture ,Hate against GMO food,Marijuana(Not really a wonder drug),  herbal remedies,Chinese medicine containing animal parts",0,2,/skeptic4ever/status/876294198659489793,
430,@LauriLinnea,Lauri Mueller,18 jun. 2017,Gmo medicine doesn't have an anti-group lying about it. Competition didn't care to fight it.,0,1,/LauriLinnea/status/876247829165068288,
431,@SuperDave629,❗️ ⚠️Super Dave ⚠️ ❗️,16 jun. 2017,"Enabled by chemicals...GMO's, vaccines, MEDICINE, chemtrails, FLUORIDE, cocaine, meth, etc...
But whatever you do...STAY AWAY FROM WEED.",2,5,/SuperDave629/status/875768658869530627,
432,@ShineJob,ShineJob 🕶️,16 jun. 2017,"A corrupt system. #ToxicMasculinity #Monsanto #FailedTech #GMO Food & Medicine should never be ""for-profit""  kids thinking....you idiots!!!! pic.twitter.com/ljtHLSeuIN",0,0,/ShineJob/status/875706463804682240,
433,@GeunesJ,Richard J Geunes,16 jun. 2017,Probably won't eat gmo food or take the dangerous poison drug companies r peddling either.,0,0,/GeunesJ/status/875665363291303936,
434,@gbcreque,Geri Creque,15 jun. 2017,"I do not want GMO foods, but recognize the benefits in medicine.",0,0,/gbcreque/status/875502892546801664,
435,@Olivefarmer,Philli H,15 jun. 2017,"If ""evidence based"" medicine a concern Nick why were gold standard trials never used by FDA GMO soy/corn based formula for reflux babies?",0,0,/Olivefarmer/status/875459597372227584,
436,@redheadgeometry,♥♪♫*¨*•.¸¸ ॐRed ♥♪♫*¨,15 jun. 2017,USA has the power: constitutional law to overstand/corporations under sovereign law & save the world GMo tyranny -plant medicine:who own it,0,0,/redheadgeometry/status/875414240005414912,
437,@AhJaq16,Adrienne Houghton,14 jun. 2017,"As SUGAR & GMO carbs are ""addictive substances"" obviously need to eliminate is first STEP in fighting 'drug' addiction",0,0,/AhJaq16/status/875105416627093504,
438,@UnholyJane420,OJ da Juiceman,13 jun. 2017,GMO free medicine  pic.twitter.com/eCKTeV5ZlM,0,2,/UnholyJane420/status/874773897651945473,
439,@JonEntine,Jon Entine,13 jun. 2017,GMO foods vs. GM medicine: What’s the difference in public acceptance? http://bit.ly/2syBrRh  via @GeneticLiteracy,19,14,/JonEntine/status/874760304940462080,
440,@DangergirlHope,DangergirlHope,12 jun. 2017,"Why not? if we can patent killer GMO's &  medicine  why not patent species, especially if it's to enslave & abuse them.",0,0,/DangergirlHope/status/874401166678831104,
441,@NoGMOsVerified,NoGMOsVerified,12 jun. 2017,Drug-Resistant bug Klebsiella Causes Worry #GMOs #GMO http://NoGMOsVerified.com  /fd http://dld.bz/ech7R,1,0,/NoGMOsVerified/status/874378216122789890,
442,@CallInalAngels,Debara,12 jun. 2017,"#Flowers enhance #garden as #edibles, all the better #Medicine Non~GMO #Clover #Dandelions #Chrysanthemum #Sunflower http://www.naturalnewsblogs.com/health-benefits-edible-flowers/ …pic.twitter.com/y0Y4E2YLoz",1,2,/CallInalAngels/status/874360522639982592,
443,@KristiGdanetz,Mrs. MacCready,11 jun. 2017,Frustrated How do people rationalize science? Climate change=real but GMO/medicine=scams. https://blogs.scientificamerican.com/guest-blog/who-are-you-calling-anti-science/ …,0,0,/KristiGdanetz/status/873903103711604736,
444,@achengula,Augustino Chengula,11 jun. 2017,Why Is Genetically Modified Organisms The Future Of Medicine? http://kipaduka.com/2017/06/11/why-is-genetically-modified-organisms-the-future-of-medicine/ …,0,0,/achengula/status/873788508711858177,
445,@Aljazirahnewsng,Aljazirah Nigeria,10 jun. 2017,"No GMO product licensed by NAFDAC – Official - The National Agency for Food, Drug Administration and Control (N... http://ow.ly/hsJz50c4gTL",0,0,/Aljazirahnewsng/status/873503205023526916,
446,@ottawatts,#SCIENCEMATTERS 🔬 🚀 🌕 ⚡,10 jun. 2017,WTH is GMO Insulin? This seems like the Kosher designation in pharma... No pigs were harmed in the making of your medicine...,0,1,/ottawatts/status/873485559964082177,
447,@wizardQi,Robert A Adjutant,9 jun. 2017,"Retweeted GMO Free USA (@GMOFreeUSA):
The Food and Drug Administration (FDA) has resumed its first-ever endeavor... http://fb.me/8EzD1GumC",0,0,/wizardQi/status/873259741094531072,
448,@FeatherFarmers,Featherstone Farm,9 jun. 2017,"I'll be in town next Wed, June 14 with OUR pork. 
Heritage breed, Apple finished, drug free, gmo free, happy... http://fb.me/1YZHrLPPK",0,0,/FeatherFarmers/status/873170331426488321,
449,@glo1115,Gloria,9 jun. 2017,@FDA_Drug_Info stop making money off treatment and allow the cancer cure to be released. Stop allowing the GMO being added to food in US,0,0,/glo1115/status/873002842759593984,
450,@WorldTruthTV,WorldTruth.TV,9 jun. 2017,Genetically Modified Micro Humans To Be Farmed For Drug Testing https://worldtruth.tv/genetically-modified-micro-humans-to-be-farmed-for-drug-testing-by-2017/?utm_source=twitter&utm_medium=social&utm_campaign=SocialWarfare … via @https://twitter.com/WorldTruthTV,2,1,/WorldTruthTV/status/872977023655968769,
451,@BlagenLogin,Blagen Login,7 jun. 2017,We're actually helping him a lot by using holistic treatments and avoiding things like allopathic medicine and GMO's,0,0,/BlagenLogin/status/872575697042014208,
452,@salixsays,Salix & Co,7 jun. 2017,Two ‘incurable’ blood cancers wiped out by genetically modified drug http://bit.ly/2qVZgOy  @thetimes by Oliver Moody,0,0,/salixsays/status/872479515355656192,
453,@NoGMOsVerified,NoGMOsVerified,6 jun. 2017,EU Drug Regulators Review Use of Last-Resort Antibiotic in Farming #GMOs #GMO http://NoGMOsVerified.com  /fd http://dld.bz/ehfVG,0,0,/NoGMOsVerified/status/872228954601644032,
454,@SoulGardenFarm,Zachary Zeifman,6 jun. 2017,Future of #hollandmarsh #leamington #niagara #ontag get off your #GMO #corn drug and hop on this cash crop   https://twitter.com/agriconsult/status/872134772725886976 …,0,0,/SoulGardenFarm/status/872214912097034241,
455,@treesarelife2,💜Carmillaria sp. 💜,6 jun. 2017,"But I agree gmo, in medicine, is a great technology",0,0,/treesarelife2/status/871982311931351040,
456,@420Tasmania,parker_vmg3,5 jun. 2017,GMO #Cannabis? Not in My Backyard  http://crwd.fr/2sDF58z  #auspol #Tasmania #healthy #organic #medicine #cure #Research #science #Gardeningpic.twitter.com/45nNhovFul,2,1,/420Tasmania/status/871716521415933953,
457,@BlagenLogin,Blagen Login,4 jun. 2017,"We've all got to go #organic and #holistic.
It would fix all these problems being caused by allopathic medicine and GMO's.",5,4,/BlagenLogin/status/871400108121665536,
458,@sagatiaej,Trisha IDLENO MOREy,4 jun. 2017,"@realDonaldTrump The world won't buy GMO foods, chemical&disease laden medicine.We R being cut from the world trade market.",0,0,/sagatiaej/status/871354538317492225,
459,@Jetwash,Doug,3 jun. 2017,The Food and Drug Administration has purchased the climate science modeling  program to approve new drugs and genetically modified Foods.,0,0,/Jetwash/status/871133024993239040,
460,@EricJohannsen,Eric Johannsen,3 jun. 2017,"Genetically modified blood stem cells to cure all allergies?
 http://dailym.ai/2sA1Muw  #biotech #singularity #medicine",1,0,/EricJohannsen/status/871023463644798976,
461,@ChartMill,ChartMill,3 jun. 2017,Ready to invest? $PYPL is definitely worth checking out today! http://stockcharts.chartmill.com/u/SkxZCQ21fW  #drug #GMO,1,0,/ChartMill/status/870851831454474240,
462,@NoirPoetograpy,TheNoirPoetographer,3 jun. 2017,"Anti-vax, anti GMO ""I’m not into western medicine. That to me is a complete scare tactic.""",0,0,/NoirPoetograpy/status/870849511186366464,
463,@suzettepetillo,Suzette,2 jun. 2017,"Burn the poppy fields. Stop #BushClintonCartel drug weakening of USA plan.
Burn the #GMO fields,too. Protect our children from sterilization",0,0,/suzettepetillo/status/870712817233518592,
464,@ChickenCheckin,ChickenCheckIn,30 may. 2017,"In 2015, the FDA approved a chicken that has been genetically modified to produce medicine for a rare disease. https://www.fda.gov/NewsEvents/Newsroom/PressAnnouncements/ucm476013.htm …",0,2,/ChickenCheckin/status/869610545443418112,
465,@politicalebooks,PoliticsBot,30 may. 2017,"Crop insurance, Obamacare, guns, debt, drug testing, CommonCore, GMO, OBamacare, marijuana, college cost.",0,0,/politicalebooks/status/869575631427837952,
466,@FarmFairyCrafts,Farm Fairy Crafts,30 may. 2017,"Food Can be Medicine or Poison. Your Body, Your Choice.  #GMO pic.twitter.com/7xkjfoi5jF",0,1,/FarmFairyCrafts/status/869550056260718593,
467,@beachvetlbc,Notorious KGB Aggie,30 may. 2017,Guess where evidence of GMO safety to pets & people is on this hierarchy in evidence based medicine. https://twitter.com/JanAlvarezVives/status/869136829546680320 …,1,2,/beachvetlbc/status/869371484333940736,
468,@CarolynEllis5,Carolyn Ellis,28 may. 2017,"You would be referring to me. I am gluten, dairy, GMO, sugar & smoke  free. Why?  Sick as hell for 9 yrs & trad medicine made me sicker",1,3,/CarolynEllis5/status/868867376015527936,
469,@brucerossbrc,Bruce Ross,28 may. 2017,"Please, please put the transgenic ex-Queensland Drug Squad cop in the Lodge
We need them banished for at least a decade
You can do it, Spud",0,1,/brucerossbrc/status/868788059818426368,
470,@maverick4pa,mark brown,27 may. 2017,"I dream of an OrganicHippocraticAmerica--50%less--CleanUp the Pesticide
GMO mess. Go back 2 God's way Organic Natural Medicine. Much better",0,0,/maverick4pa/status/868605907529330689,
471,@raudelmil,Raul Miller,27 may. 2017,That whole Afghanistan thing probably revolves around poppies and drug trade - probably best addressed by GMO methodologies?,0,0,/raudelmil/status/868594285909823488,
472,@CrinCorrall,Crin Corrall,27 may. 2017,"Heavenly Father we need more information on getting clean GMO free & healthier. Help us avoid/label Big Pharma, Ag, medicine in #JesusNamehttps://twitter.com/realdonaldtrump/status/868501423566315520 …",0,0,/CrinCorrall/status/868513442709336065,
473,@crvallotton,Diagnosis my RIGHT!,27 may. 2017,"#GMO Side Effects with Jeffrey Smith
#Health do your research. Food is medicine https://www.youtube.com/watch?v=uwX2xTf9i-I&feature=share …",1,1,/crvallotton/status/868281063595966465,
474,@topdeserttrader,humbletrader,26 may. 2017,FDA has allowed food & drug companies to poison our food with GMO that cause cancer & many other health issues. You lie & support them for $,0,0,/topdeserttrader/status/868198531760246785,
475,@AgriKiev,AgriKyiv,26 may. 2017,"Debate challenge by 14 agrarian universities won by Lviv veterinary medicine. Topics; GMO, tax system & small farms pic.twitter.com/hgf9MLU1PB",0,0,/AgriKiev/status/868087724200382464,
476,@ShineJob,ShineJob 🕶️,26 may. 2017,"GMO ""food"" & ""medicine"" is failed tech, so dangerous, so last century. #dumpthejunkpic.twitter.com/IuHkt0v89Y",6,3,/ShineJob/status/868034651578912768,
477,@sam_manna3,Sam Manna,26 may. 2017,Use of genetically modified bacteria for drug delivery in humans: Revisiting the safety aspect https://www.nature.com/articles/s41598-017-02591-6 …,1,1,/sam_manna3/status/868016366774738944,
478,@Derekjw,Derek Williamson,26 may. 2017,@artdesignunsw #students #interactive @Diseasemuseum about #gmo #ethics #science #medicine… https://www.instagram.com/p/BUiPyM-Bvtg/,1,1,/Derekjw/status/867897132425986048,
479,@gmo_crops,GMO Crop News,26 may. 2017,#GMO news: Problems at Sun Pharma plant trip up drug approval http://ow.ly/5aBP50bJEWL,0,0,/gmo_crops/status/867894951996215296,
480,@ldanaross,Dana Ross,25 may. 2017,In the Lab today. Make your own medicine.  GMO free pic.twitter.com/27Ff61xmZd,0,3,/ldanaross/status/867758950577569797,
481,@gmo_crops,GMO Crop News,24 may. 2017,#GMO news: US FDA rejects Sun epilepsy drug due to ongoing problems at Halol plant http://ow.ly/vF8Y50bHjGW,0,0,/gmo_crops/status/867349920197615618,
482,@ReaD_Earthling,Rea D.,24 may. 2017,"Say NO to #GMO and #FastFood; no to #poison!
#Organic and #nonGMO is the way to go!
#nutrition #health #natural #medicine #healing #foodhttps://twitter.com/Top_TruthSeeker/status/865764759110660097 …",0,7,/ReaD_Earthling/status/867227635423875072,
483,@potter_academia,Potter vs. Academia,23 may. 2017,Harry Potter and The Use of Genetically Modified Bacteria for Drug Delivery in Humans: Revisiting the Safety Aspect,0,0,/potter_academia/status/867092872264396805,
484,@GlobalFarmerNet,GlobalFarmerNetwork,22 may. 2017,"Genetically modified seeds help us defeat weeds, pests, disease; modern medicine keeps our animals healthy. http://bit.ly/2ruMtDw",1,4,/GlobalFarmerNet/status/866757813716078592,
485,@15minutemilla,BMills,22 may. 2017,You can ask a drug dealer anything you want. They're in place to provide the best service and a non GMO organic product. Stop the #FakeNews,0,0,/15minutemilla/status/866643396630368256,
486,@adaminberlin,Adam Lockett,21 may. 2017,"Look up the scientific, non partisan consensus on these topics:
GMO
Nuclear power
Organic food
Alternative medicine",0,0,/adaminberlin/status/866273242331459587,
487,@Holla_Bishop,"Bi$hop, from Juice",21 may. 2017,I liked a @YouTube video http://youtu.be/8PbN7EASEsI?a  GMO BABY- FEAT 1 LUV LETT (D.A STREET) drug association,0,0,/Holla_Bishop/status/866106254388625408,
488,@DesireeSeattle,DK Seattle,20 may. 2017,Mike Adams AKA  natural news.. sell products. he scares ppl from real medicine & he attacks GMO scientists & called for their being killed.,0,0,/DesireeSeattle/status/866072035855749120,
489,@yourweavesmells,NOBLE:DREW:ALI  Ⓥ,20 may. 2017,Food is medicine but niggas want gmo,0,0,/yourweavesmells/status/866066814526246912,
490,@maverick4pa,mark brown,19 may. 2017,"We need national debates regarding Genetics! Genetic Biowarfare=End of Days?
Hiding GMOs is so UnAmerican! Pesticide-GMO-AB-Drug soup.",0,0,/maverick4pa/status/865656298355834882,
491,@FalseFlagOps,((((We Are Awake)))),19 may. 2017,This wall is the one that needs to be built! Found @medicine_man01 #utah #churchandstate #lds #propaganda #nwo #gmo… https://www.instagram.com/p/BUQR_nKFqCo/?utm_source=dlvr.it&utm_medium=twitter …pic.twitter.com/IMLbXUMuWL,0,0,/FalseFlagOps/status/865370613178712065,
492,@File__Not_Found,[error],18 may. 2017,tru is pretty pro-business so doubt he'd push gmo issue. he may tighten up drug laws- gotta keep those private prisons full,0,1,/File__Not_Found/status/865344668627816449,
493,@TruthGoddess1,Ma'at,18 may. 2017,"I was diagnosed with Crohn's a year ago...went on a bunch of big pharma meds...got worse, cut out all GMO and medicine, I am fine now!",0,1,/TruthGoddess1/status/865306886106734592,
494,@dwarfisblack,the black dwarf,18 may. 2017,SO ... GMO IS OK AND ......FDA Classified Walnuts As An Illegal Drug http://www.revolutions2040.com/fda-classified-walnuts-illegal-drug/ …,0,0,/dwarfisblack/status/865267184624435200,
495,@foodafricaexpo,Food Africa Expo,18 may. 2017,"#FoodWestAfrica event, was launched by GMO Chukwumah, Director, Food and Drug Services, Federal Ministry of Health http://ht.ly/b5Pp30bPvRX pic.twitter.com/OufCVujx6s",1,1,/foodafricaexpo/status/865145311072833536,
496,@GuthrieWilson,Guthrie Wilson,17 may. 2017,"Banking, gas & oil, big pharmaceutical and gmo brought us to incurable disease. Funny how the drug companies are in cahoots with the lawyers pic.twitter.com/rwJFC5CbFO",1,1,/GuthrieWilson/status/864927292593586176,
497,@FarmFairyCrafts,Farm Fairy Crafts,17 may. 2017,"Food Can be Medicine or Poison. Your Body, Your Choice.  #GMO pic.twitter.com/OiFklV67CD",0,0,/FarmFairyCrafts/status/864799782530949120,
498,@xetrixa,XETRIXA,17 may. 2017,"""Technology is killing humans slowly"" he says on SOCIAL MEDIA benefitting from MODERN MEDICINE and GENETICALLY MODIFIED CROPS pic.twitter.com/60qnDw2bfI",0,0,/xetrixa/status/864731774928203776,
499,@OWLKINGLORD,Sound Boy  🦉,16 may. 2017,Hookah is a gateway drug to non gmo anal bleach cream https://twitter.com/katvvee/status/864516087114870784 …,0,0,/OWLKINGLORD/status/864518811235516418,
500,@sara8smiles,Waking Warriors  ✊,16 may. 2017,"#Cannabis is medicine. Don't let the fake government take control of it and GMO it to fucking death, eh? pic.twitter.com/zhE5pn07FJ",18,24,/sara8smiles/status/864490654814150657,
501,@JanetCaliri,Janet Caliri,16 may. 2017,"Dr. Gail Dubinsky speaking on GMO's
at Food For Medicine. http://fb.me/5wrUCc7Iz",0,0,/JanetCaliri/status/864309144211402753,
502,@gardening_evw,Gardening Everywhere,15 may. 2017,"Into #survival #medicine? You can plant up your own #herbs with these non-#gmo, non-hybrid seeds http://bit.ly/gardenmedicine   pls sharepic.twitter.com/yH8vuoafoM",0,0,/gardening_evw/status/864090004125077504,
503,@Scottie639Scott,bradley scott,14 may. 2017,"Transvestism gay marriage sexualised children pedo's gmo foods banning natural food an medicine, all satanism not Jewish",0,1,/Scottie639Scott/status/863835396655857664,
504,@PLTC_PastLives,"PastLifeTherapyCenter, @DrThomasPaul",14 may. 2017,"Paying attention?#Medicine is mostly a criminal operation.
#CDC #FDA #MSM #gmo #AMA #VAXXED #BigPharma
@wikileaks @RealDonaldTrump #Monsantopic.twitter.com/dwWgQXunUK",55,47,/PLTC_PastLives/status/863552315847958528,
505,@beachvetlbc,Notorious KGB Aggie,13 may. 2017,"Please justify ur own seat in policy on subjects of public health, medicine, nutrition, animal health, GMO. 
UR graduate science degree????",4,3,/beachvetlbc/status/863225345947783169,
506,@WhatSaoCarlos,What Sao carlos,12 may. 2017,"Transgenic livestock as drug factories... (https://www.facebook.com/events/534571796931793/?acontext= …{""ref"":""108"",""action_history"":""null""})",0,0,/WhatSaoCarlos/status/863106640144457728,
507,@FuturaDoctora_,Melissa,12 may. 2017,"Idk if I'm interpreting right, but do you mean like GMO & plague for agriculture or stem cells & antibiotic resistance for medicine?",0,0,/FuturaDoctora_/status/862883972140982272,
508,@PatriotWriter,Priscilla Jones,11 may. 2017,Allison's Journey to #Fertility http://ln.is/branchbasics.com/blo/H81Fi … #organic #culinaryherbs #natural #pcos #health #truth #medicine #emf #toxic #gmo,0,0,/PatriotWriter/status/862675535419322369,
509,@GMO_eater,vaccine taker,11 may. 2017,"my favorite talks in order:
drug talk
consciousness talk
gun talk
paranormal talk
conspiracy talk
anime talk fits in there somewhere
games??",0,1,/GMO_eater/status/862540607926935552,
510,@melsbrew,Melsbrew,10 may. 2017,"Ivanka.  The American People stay healthy with no pesticides, no preservatives, no GMO, no Chemtrails, no drug Co. & only organic food. :)",2,3,/melsbrew/status/862426567389192192,
511,@Scottie639Scott,bradley scott,10 may. 2017,Doctrine of lucifer is replace everything natural with the unnatural. eg gmo food gays and transgender banning natural medicine,0,0,/Scottie639Scott/status/862398778585698304,
512,@NutritionSolut,Nutrition Solutions,9 may. 2017,You Are Eating Poison! Here’s How To Identify GMO Tomatoes In 2 Easy Steps - I  Natural Medicine http://fb.me/12x3YeRS7,0,0,/NutritionSolut/status/862066949848748032,
