,Usuario,Nombre,Fecha,Tweet,RT,like,path,verificados
1072,@ncsoybeans,NC Soy Prod Assoc,13 sept. 2016,SoyMeds awarded $1M from the NIH to help advance its unique system for “growing” medicine in transgenic soybeans. http://ow.ly/MfY9304ad6J,0,0,/ncsoybeans/status/775686759359320064,
1073,@FarmFairyCrafts,Farm Fairy Crafts,13 sept. 2016,"Food Can be Medicine or Poison. Your Body, Your Choice.  #GMO pic.twitter.com/bB3kIrdGIy",0,0,/FarmFairyCrafts/status/775685510245285889,
1074,@_jenniferlong,#Shadowbanned Jen  🤐,13 sept. 2016,The New England Journal of Medicine Asks FDA to Reconsider Labeling GMO Foods via @EcoWatch http://www.ecowatch.com/the-new-england-journal-of-medicine-asks-fda-to-reconsider-labeling-gm-1882088170.html …,0,1,/_jenniferlong/status/775676717692321792,
1075,@FarmFairyCrafts,Farm Fairy Crafts,12 sept. 2016,"New England Journal Of Medicine says Label #GMO Clearly
On Package Easy2C
Expert Advise
@clairecmc MO @RoyBlunt MOhttp://tinyurl.com/hf3vxu5",0,0,/FarmFairyCrafts/status/775541832726044672,
1076,@JoyceAnnRobins4,Joyce Ann Robinson,12 sept. 2016,had same 3months every drug nothing worked cough Gmo fungus lungs iv with liquid prednisone take away 24h,2,4,/JoyceAnnRobins4/status/775376651995586560,
1077,@_qp9669,N-Az 2live,11 sept. 2016,"I DON'T watch tv ""sports""
I DON'T eat Gmo food ""fast food""
I only drink water ""wine"" 
I DON'T do drugs ""weed is not a drug""",0,0,/_qp9669/status/775180245787783169,
1078,@hubalsprophet,hubalsprophet,11 sept. 2016,designer crops may be the future of medicine - what if ancients created some good gmo? Though i am not a gmo supporter,0,0,/hubalsprophet/status/775109966877298688,
1079,@yeshuanegid,Yeshua Negid,11 sept. 2016,"@43georgebush Prescott should have been hung, Pop poisons us with GMO and drug running with Bill. You executed or jailed for 911. Pure evil",0,0,/yeshuanegid/status/775094285284716545,
1080,@yeshuanegid,Yeshua Negid,11 sept. 2016,"@GeorgeHWBush Prescott should have been hung, you started GMO and drug running with Clinton. GWB executed for 911. God will expose your evil",0,0,/yeshuanegid/status/775093587994222592,
1081,@greystone75,Tom Morris,10 sept. 2016,The Seralini GMO Study – Retraction and Response to Critics « Science-Based Medicine https://www.sciencebasedmedicine.org/the-seralini-gmo-study-retraction-and-response-to-critics/ …,0,0,/greystone75/status/774764550612590594,
1082,@Bobby_Cinco,♦️,9 sept. 2016,I wouldn't take medicine for anything . It's a gmo which moves the Sickness to another part of the body .,0,0,/Bobby_Cinco/status/774244152271785984,
1083,@GenexaHealth,Genexa,7 sept. 2016,What's in your medicine? All Genexa products are #non-gmo #glutenfree & have no artificial flavors or colorshttp://ow.ly/WQk1303rEuT,0,1,/GenexaHealth/status/773557828791439361,
1084,@CfKitou,伊藤　孝司,7 sept. 2016,@DistantDystopia Thank you for following me. I have been working on enzyme drug development by utilizing transgenic silkworm. Best regards.,0,0,/CfKitou/status/773445664176996375,
1085,@8extremes,8extremes,6 sept. 2016,"FOOD IS LOVE
FOOD IS LIFE
FOOD IS MEDICINE
TOXIC GMO JUNKFOOD HARMS HEALTH
#DarkActUNCONSTITUTIONAL @vtrighttoknowpic.twitter.com/nbD7w09FxE",5,6,/8extremes/status/773347599453556736,
1086,@victoriaa0830,Victoria McCormick,6 sept. 2016,Put two and two together here...  same people developing these GMO seeds help develop/supply your medicine #Bayer,0,1,/victoriaa0830/status/773174672691257345,
1087,@zarafa,isobel.lowther,5 sept. 2016,38 countries will not take our GMO wheat or drug laden meat How many more agricultural losses can we take ? NO TPP,0,0,/zarafa/status/772789780585320448,
1088,@GMOFreeCanada,GMO Free Canada,4 sept. 2016,"More unresolved GMO issues 
   ""... Liability – Drug manufacturers are required to list the potential negative... http://fb.me/4WR7iiL9W",0,1,/GMOFreeCanada/status/772571762684891136,
1089,@retiredfirstsgt,Richard Punko,4 sept. 2016,I trust science& Medicine. Anti GMO ppl same category as anti vaxxers,0,0,/retiredfirstsgt/status/772342731788038144,
1090,@FarmFairyCrafts,Farm Fairy Crafts,3 sept. 2016,"New England Journal Of Medicine says Label #GMO Clearly On Package Easy2C Expert Advise @Stabenow
#4SimpleWords",1,0,/FarmFairyCrafts/status/772264973347201024,
1091,@exposeconspirac,expose conspiracy,3 sept. 2016,if Russia Banned from Para Olympics for failing drug tests then I AM ATHLETE of the World.. LABEL ALL GMO FOODS!,0,0,/exposeconspirac/status/772145045688373248,
1092,@darkone1,nameless1,3 sept. 2016,#Monsanto creates #GMO strain #Marijuana http://www.organicandhealthy.org/2016/09/monsanto-creates-first-genetically.html … #CorporateControl #Weed #EnslavingNature #Insanity not #Organic #Medicine,0,2,/darkone1/status/772133748825612289,
1093,@DrPat_Reads,Pat Cummings,2 sept. 2016,"Black Rain: Genetically-modified humans? GMO medicine? My review is ""GMO Slavery"" at http://goo.gl/AVCYrW pic.twitter.com/1IBlPX83L7",0,0,/DrPat_Reads/status/771809738602545152,
1094,@Shania61Fowler,Catherine Fowler,2 sept. 2016,Drug Company Owns Monsanto and Their Weed Killer is What Funds GMO Crops http://articles.mercola.com/sites/articles/archive/2001/08/08/gmo-crops-part-two.aspx … via @mercola,0,0,/Shania61Fowler/status/771652920685187072,
1095,@scotgratis,Scot,1 sept. 2016,"Its also funny/ironic that the companies that own the genetically modified seeds, own the drug companies...",0,1,/scotgratis/status/771602607169155072,
1096,@TheVictoryBell,Buckeye  🚨 🇺🇸,1 sept. 2016,Clinton created ISIS & millions of refugees. She supports GMO's. Mandatory minimum prison for non violent drug crimes.,0,0,/TheVictoryBell/status/771599494190202881,
1097,@chefgigi,Chefgigi,1 sept. 2016,The New England Journal of Medicine Asks FDA to Reconsider Labeling GMO Foods via @EcoWatch http://www.ecowatch.com/the-new-england-journal-of-medicine-asks-fda-to-reconsider-labeling-gm-1882088170.html …,0,0,/chefgigi/status/771587195895357441,
1098,@ShelterSense,Organic Universe,1 sept. 2016,"#GMO Foods are Inherently Unsafe, Warns American Academy of #Environmental Medicine http://bit.ly/1VyGuob",0,0,/ShelterSense/status/771501187002691584,
1099,@BritishPodcast,The British History Podcast,31 ago. 2016,"Coproducer Zee is sick and is trying to convince me that whisky is medicine because it's ""gmo free, ionized, and ph balanced for a woman.""",3,49,/BritishPodcast/status/771156389162946560,
1100,@nisistaffingloc,NISI Staffing,30 ago. 2016,Now recruiting Consultant General Medicine locums http://ow.ly/NgKY303I8dF  #GP #Locum #Medicine #Consultant #GMO,0,0,/nisistaffingloc/status/770607235072401410,
1101,@FarmFairyCrafts,Farm Fairy Crafts,30 ago. 2016,"Food Can be Medicine or Poison. Your Body, Your Choice.  #GMO pic.twitter.com/NxMHdIRbST",0,0,/FarmFairyCrafts/status/770551671491588096,
1102,@TTGrapevine,Michelle,29 ago. 2016,"Anyone who charges 500%+ for life-saving medicine is the devil. But, now you know why GMO food is such a risk to... http://fb.me/EOI44ATl",0,0,/TTGrapevine/status/770235134473826304,
1103,@MattCyphers,Drizzt Do'Urden,28 ago. 2016,I just parked between a 2-car drug deal sandwich. They picked up the drugs inside ears of corn. Enjoy your organic non GMO meth!,0,1,/MattCyphers/status/770041463619063808,
1104,@mwirth525,Michael Wirth,28 ago. 2016,"@rosevine3 regarding your RT of GMO's ""Socialized medicine (medicare for all) must include socialized agriculture (healthy food for all)""",1,2,/mwirth525/status/769942217645522944,
1105,@angelacatkins,Angela Atkins,26 ago. 2016,"National Academies of Sciences, Engineering, and Medicine report on GMO's in a nutshell: http://ow.ly/oLTY303pOMQ",0,0,/angelacatkins/status/769248644893638656,
1106,@differentbreid,dB,26 ago. 2016,"hopefully yes, although, weirdly, consumption of medicine/pharma products (from GMO tech) has never really become an issue?",0,0,/differentbreid/status/769196833721679873,
1107,@willsgeneralw,willsgeneral,24 ago. 2016,Food really is medicine! #fit #nutrition #health #healthy #sport #sports #food #gmo #fruit #veganpic.twitter.com/sPeaD2e6eH,0,0,/willsgeneralw/status/768588744320487429,
1108,@VeritasIRB,Veritas IRB Inc.,24 ago. 2016,#GMO Mosquito Gets @FDA_Drug_Info Approval For Testing to fight #Zika http://www.npr.org/2016/08/06/488969845/zika-fighting-gmo-mosquito-gets-fda-approval-for-testing … @NPRHealth @NPR,0,0,/VeritasIRB/status/768446337532694528,
1109,@8extremes,8extremes,23 ago. 2016,"FOOD IS LOVE
FOOD IS LIFE
FOOD IS MEDICINE
TOXIC GMO JUNKFOOD HARMS OUR HEALTH  
#RepealDarkAct @vtrighttoknowpic.twitter.com/4RhrFSxhO1",11,5,/8extremes/status/768277610577092609,
1110,@FarmFairyCrafts,Farm Fairy Crafts,23 ago. 2016,"Food Can be Medicine or Poison. Your Body, Your Choice.  #GMO pic.twitter.com/JMYNxuBYKo",2,0,/FarmFairyCrafts/status/768188115618000896,
1111,@NoGMOsVerified,NoGMOsVerified,23 ago. 2016,Zafgen Soars on Hope of Reviving Obesity Drug Tests #GMOs #GMO http://NoGMOsVerified.com  /fd http://dld.bz/ej3cD,0,1,/NoGMOsVerified/status/768082699139645441,
1112,@aefield91,Adam Field,23 ago. 2016,Climate deniers and fossil fuel. GMO scaremongers and organics. Anti-vaxers and alternative 'medicine' Everyone selling something.,0,1,/aefield91/status/768063234951774208,
1113,@Medicine_Life,Kazi,23 ago. 2016,"For those who know when to exhale.
#Monsanto will soon be your GMO Weed supplier. http://bit.ly/2bIsdqb",0,1,/Medicine_Life/status/768030356729724928,
1114,@endre_sebestyen,Endre Sebestyén,23 ago. 2016,quorum lysis of genetically modified bacteria as a drug delivery platform to target tumors http://www.ncbi.nlm.nih.gov/pubmed/27437587,0,0,/endre_sebestyen/status/768029742687744000,
1115,@russellp475,okcwingsofdesire,22 ago. 2016,Drug Company Owns Monsanto and Their Weed Killer is What Funds GMO Crops http://articles.mercola.com/sites/articles/archive/2001/08/08/gmo-crops-part-two.aspx … via @mercola,0,0,/russellp475/status/767690554649944064,
1116,@DerivativesDude,Derivatives Dude®  📈,21 ago. 2016,"In case you weren't aware, poison is everywhere. In our food (GMO), water (fluoride), medicine (vaccines), and more. #gmo #fluoride #vaccine",0,0,/DerivativesDude/status/767564730173038592,
1117,@SoItBegins_,Alejandro Gonzalez,21 ago. 2016,marketing is a hell of a drug? Most of them are too young to know any better. A need to fill their GMO deficiency?,0,3,/SoItBegins_/status/767406280533282816,
1118,@fruitorhuman,Maja,21 ago. 2016,For future reference: avoid people who heavily advocate alternative medicine and condone GMO crops,0,0,/fruitorhuman/status/767270611144114176,
1119,@BluMantic,Niebo,20 ago. 2016,@Supnater brotha...that GMO joint on soundcloud is medicine for the times. Follow back so I we can link some how. #peace,0,0,/BluMantic/status/767217888033931264,
1120,@NeverAgainKW,Never Again,20 ago. 2016,Oxitec makes no claim that their GMO mosquitoes can fight Zika. Doing so might put the product under human drug... http://fb.me/1lnYNjeaG,0,0,/NeverAgainKW/status/767114870152126467,
1121,@casrose10,Cassandra Rose,20 ago. 2016,"Considering the Military , Drug, oil, pesticides, gmo world own our US Capitol to make $$ profit off hurting... http://fb.me/6rNzQ0Azk",0,0,/casrose10/status/767030660871532544,
1122,@Pvincell,Paul Vincelli,20 ago. 2016,@gkpalmer Tobacco as an experimental source of life-saving antimalarial drug: https://elifesciences.org/content/5/e13664 …. A humanitarian GMO.,0,1,/Pvincell/status/766968939167440896,
1123,@MossSolomon,Solomon Moss,19 ago. 2016,"I know all of this, & several old ladies r scared of gmo mosquitos,& tht #OXITEC is under animal drug status",0,0,/MossSolomon/status/766727357839265792,
1124,@arboviral,Anthony Wilson,19 ago. 2016,Related: heard some time ago that drug agencies worried about future potential for narcotic production using transgenic yeast.,0,0,/arboviral/status/766586225033633792,
1125,@wizardQi,Robert A Adjutant,19 ago. 2016,"Retweeted GMO Free USA (@GMOFreeUSA):
Let Food Be Thy Medicine: A Maryland hospital has gone organic, inspired... http://fb.me/2XIQWcbRK",0,0,/wizardQi/status/766567641469161472,
1126,@SergeyAlaziev,Al,19 ago. 2016,"GMO athletes from the US,Canada,UK are taking a drug in the form of nutritional supplements WADA are not able to recognize",0,3,/SergeyAlaziev/status/766559871542046720,
1127,@BadProductionz,Bad Girl Productionz,18 ago. 2016,"#GMO studies show causes diabetes cancer obesity, which in turn needs medicine @which no Regulating prices are setpic.twitter.com/nwrZwmBut1",0,0,/BadProductionz/status/766274192765440000,
1128,@gmo_crops,GMO Crop News,17 ago. 2016,#GMO news: Pfizer vancomycin supplier Zhejiang Medicine warned by US FDA http://ow.ly/4ifU503A3O4,0,0,/gmo_crops/status/766063133320417284,
1129,@johnlagalite,John La Galite,17 ago. 2016,"The Truth About Salmon
Wild, Farm-Raised, and Now, GMO
On today’s food as medicine, we dive into all things... http://fb.me/2bszHIKVW",0,0,/johnlagalite/status/765934603643256832,
1130,@FarmFairyCrafts,Farm Fairy Crafts,16 ago. 2016,"New England Journal Of Medicine says Label #GMO Clearly
On Package Easy2C
Expert Advise
@clairecmc MO @RoyBlunt MOhttp://tinyurl.com/hf3vxu5",1,1,/FarmFairyCrafts/status/765683854543761408,
1131,@Drug_Ed_Teacher,Jesse M. Crosby,16 ago. 2016,"@abc7ellen @abc7coleen @abc7 Ladies, can you ask how Genetically Modified and Processed food contribute to Cancer development risks",0,1,/Drug_Ed_Teacher/status/765681382622244864,
1132,@ZimJay,Zimfara Janus,16 ago. 2016,"interesting!  Could say today we all live in an untested #drug #vaccine & #GMO food camp. 
#Freedumb",5,6,/ZimJay/status/765581420664352768,
1133,@CfKitou,伊藤　孝司,15 ago. 2016,@evergreen_0902 Thank you for following me. I am studying on drug discovery for lysosomal diseases by utilizing transgenic silkworm.,0,0,/CfKitou/status/765185148669222912,
1134,@vgr,Venkatesh Rao,14 ago. 2016,"Prediction: By 2116 we'll have GMO Olympics, Conventional Heirloom Olympics, Organic, Drug-Free Heirloom Olympics, and Special Olympics.",26,56,/vgr/status/765061501900120068,
1135,@redlotus68,Stephanie J Golden,14 ago. 2016,I smell the drug war up in the GMO thing.,0,0,/redlotus68/status/765049851679604738,
1136,@beachvetlbc,Notorious KGB Aggie,14 ago. 2016,I am a Doctor of Veterinary Medicine. Most GMO studies are on animals & my patients eat #GMO Do you have patients? https://twitter.com/Tomeopaste/status/764980108272799744 …,2,5,/beachvetlbc/status/764980683592708096,
1137,@IAMMRMADDWEST,Mr Maddwest Jarmon,14 ago. 2016,"GMO Chicken: FDA Approves Genetically Modified Hens, But For Medicine, Not Food - Knowledgeroom2 http://fb.me/81NHY27lv",0,0,/IAMMRMADDWEST/status/764946829750308865,
1138,@NoGMOsVerified,NoGMOsVerified,14 ago. 2016,Drug-Resistant bug Klebsiella Causes Worry #GMOs #GMO http://NoGMOsVerified.com  /fd http://dld.bz/ech7R,1,1,/NoGMOsVerified/status/764916814233079808,
1139,@RajLinks,P Rajendran,13 ago. 2016,Anti-inflammatory drug mefemanic acid reverses memory loss in transgenic rats with Alzheimer's symptoms http://www.manchester.ac.uk/discover/news/treatment-option-for-alzheimers-disease-possible/ … #science,0,0,/RajLinks/status/764685864899227661,
1140,@Loki_Wa,Loki In Seattle,13 ago. 2016,The New England Journal of Medicine Asks FDA to Reconsider Labeling GMO Foods via @EcoWatch http://rbl.ms/29y1Xij,0,0,/Loki_Wa/status/764508771234131970,
1141,@Monoganie,Mono,13 ago. 2016,"fluoride, msg, gmo, aspartame, chemtrails, e-numbers, refined sugar and salt in everything, medicine, enough?",1,0,/Monoganie/status/764497555136929792,
1142,@Goshuaa,POSH,12 ago. 2016,If I ever got cancer I would go like vegan/gluten/GMO free cos fuck medicine,0,3,/Goshuaa/status/764172479132606464,
1143,@gmo_crops,GMO Crop News,11 ago. 2016,#GMO news: Valeant gives six months timeline for FL plant reinspection after eye drug CRL http://ow.ly/lAFF503nH26,0,0,/gmo_crops/status/763888466958639104,
1144,@killabraybray,🅱️raden,11 ago. 2016,"because the elites have access to medicine we don't, and they eat  organic while the rest of the country chows down on GMO's.",0,0,/killabraybray/status/763800505864843264,
1145,@dkartscastle,Karts Castle,10 ago. 2016,"Genetically Modified (G.M.) mosquito...For the first time, the United States Food and Drug Administration... http://fb.me/1iJQGFUl0",0,0,/dkartscastle/status/763586064032210944,
1146,@Trianni_mAb,Trianni,10 ago. 2016,EVOTEC AG REPORTS  strengthening of drug discovery platforms w/ Trianni's transgenic technology https://uk.finance.yahoo.com/news/evotec-ag-reports-results-first-052952355.html … via @YahooFinanceUK,0,0,/Trianni_mAb/status/763381680186937344,
1147,@FarmFairyCrafts,Farm Fairy Crafts,9 ago. 2016,"Food Can be Medicine or Poison. Your Body, Your Choice.  #GMO pic.twitter.com/bqIXzgdvtY",0,0,/FarmFairyCrafts/status/763267668518510592,
1148,@sharirawsomeliv,shari leiterman,9 ago. 2016,"Appalling to say the least. But now we have drug commercials, gmo foods, monsanto taking over the foods, we give... http://fb.me/3dLicipYJ",0,0,/sharirawsomeliv/status/763227256055554048,
1149,@gmo_crops,GMO Crop News,9 ago. 2016,#GMO news: Grobo Puts Sophistication into HomeGrown Food and Herbal Medicine http://ow.ly/3ssS503j3YC,0,1,/gmo_crops/status/763165808747024384,
1150,@gmo_crops,GMO Crop News,9 ago. 2016,#GMO news: Future of drug pricing paying for benefits not per pill http://ow.ly/lA0K503j3YD,0,0,/gmo_crops/status/763165808377954305,
1151,@ElbertSilas,Donna Silas,9 ago. 2016,The US Food and Drug Administration gave its final approval for a field trial releasing the genetically modified insects in the Florida,2,0,/ElbertSilas/status/763152392909099008,
1152,@MedicosCubanos,MedicosCubanos.com,9 ago. 2016,"#News: #USA #FDA approves test with genetically modified mosquitoes to fight #zika
#ZikaVirus #genetics #medicine https://twitter.com/MedicosCubanos/status/763145728185204742 …",2,1,/MedicosCubanos/status/763146370953965568,
1153,@RubiconGenomics,Rubicon Genomics,9 ago. 2016,"#Olympic Drug Cops Will Scan for Genetically Modified #Athletes #gottacatchemall
http://goo.gl/OG8hlO pic.twitter.com/ZsxlLWDaMw",0,1,/RubiconGenomics/status/763133088692076545,
1154,@TheGOPJesus,Republican Jesus,9 ago. 2016,"Go talk to the New England Journal of Medicine. GMO labels for health risks...
Label or BOYCOTT #GMO",0,0,/TheGOPJesus/status/763080574818881536,
1155,@Allendale_inc,"Allendale, Inc.",9 ago. 2016,South Korea's Ministry of Food & Drug Safety announced it did not find GMO #wheat in testing US wheat imports coming from Washington state,1,1,/Allendale_inc/status/762988774435409921,
1156,@EagleSpiritSong,EagleSpiritSong,9 ago. 2016,"SunYang's check was mistake by heartdisease pill, and the center has clarified. Pork in CN they add drug in case more slim like GMO food.",0,0,/EagleSpiritSong/status/762951468286521344,
1157,@nancygaddison,nancyaddison,8 ago. 2016,#non-GMO is the #safe #healthy #food way to go! #organic is #health . #food is your #medicine https://twitter.com/nongmoreport/status/762738491029467136 …,0,2,/nancygaddison/status/762784188361826304,
1158,@RachelsNews,Rachel Parent,8 ago. 2016,Imagine if D Oath was taken Seriously w/ this principle “Let food be thy medicine and medicine be thy food”? No #GMO https://twitter.com/kenjaques/status/762686993621024768 …,11,16,/RachelsNews/status/762765585700810754,
1159,@youranonfactz,Your Anon Facts,8 ago. 2016,[Environment] Research States That Genetically Modified Mosquitoes Cause No Threat: The US Food and Drug... http://bit.ly/2aV4OBF  #YAF,0,0,/youranonfactz/status/762658446235738112,
1160,@Class913fm,Class 91.3Fm,8 ago. 2016,The U.S. Food and Drug Administration has approved genetically modified mosquitoes as part of a trial to control... http://fb.me/1kpnjoSWv,0,0,/Class913fm/status/762585222210650112,
1161,@rwinbush,Ray Winbush,8 ago. 2016,"""According to Obama’s own Food and Drug Administration, if enacted, the bill would exempt most current GMO foods... http://fb.me/8lNthaDSz",1,0,/rwinbush/status/762565798741340160,
1162,@Cinderella420,Chechen Rebel,7 ago. 2016,@DrJillStein has done no research on GMO's vaccines but loves flirting with quack medicine. The FDA & CDC are trustworthy,0,0,/Cinderella420/status/762539022828773376,
1163,@stilrolin,Rolin,7 ago. 2016,And he eats gmo and dies of cancer before medicine is sold to his country cleaning his financials out,0,0,/stilrolin/status/762472619174006785,
1164,@FarmFairyCrafts,Farm Fairy Crafts,7 ago. 2016,"New England Journal Of Medicine says LABEL #GMO Clearly ON Package EASY2C Expert Advise 
@SenThomTillis",0,0,/FarmFairyCrafts/status/762411814856585216,
1165,@pengraiggoch,Ruth Watkins,7 ago. 2016,There is a subtle difference between Genetic Modification and Transgenic genetics! In medicine we could not get on without transgenic genes,0,0,/pengraiggoch/status/762322966885568512,
1166,@taconservative,Jillian Becker,7 ago. 2016,The Federal Drug Administration has given the go-ahead to Oxitec to release thousands of genetically modified... http://fb.me/2ufZvXj8b,0,0,/taconservative/status/762322124971266049,
1167,@thus_spake,Thus Spake,7 ago. 2016,Genetically modified mosquitoes approved to battle Zika in Florida Keys: The U.S. Food and Drug Adminis... http://bit.ly/2aR15ET  (CBC),0,0,/thus_spake/status/762226835610402816,
1168,@OTGNCanada,OnTheGroundNews.ca,7 ago. 2016,Genetically modified mosquitoes approved to battle Zika in Florida Keys: The U.S. Food and Drug Administration has… http://dlvr.it/LzL82g,0,0,/OTGNCanada/status/762218507467567105,
1169,@FarmFairyCrafts,Farm Fairy Crafts,6 ago. 2016,"If Food is Medicine, & for FDA Approval Medicines Go Through Clinical Trials, Why is #GMO Food Treated Differently w/o Requiring Trials?",1,2,/FarmFairyCrafts/status/761965338451910656,
1170,@FarmFairyCrafts,Farm Fairy Crafts,6 ago. 2016,"New England Journal Of Medicine says Label #GMO Clearly
On Package Easy2C
Expert Advise
@clairecmc MO @RoyBlunt MOhttp://tinyurl.com/hf3vxu5",2,1,/FarmFairyCrafts/status/761901417779044352,
1171,@U2Healing,U2Healing,6 ago. 2016,#FDA #news FDA Approves GMO Mosquito Test to Fight Zika: …  following the U.S. Food and Drug Administration's... http://bit.ly/2aNEVn3,0,0,/U2Healing/status/761853394684260353,
1172,@ziggisantini,Ziggi Ivan Santini,6 ago. 2016,The FDA just approved genetically modified mosquitoes to fight Zika in Florida | #medicine #genetic #engineering http://sco.lt/6F0K5h,0,0,/ziggisantini/status/761843000217595904,
1173,@MRTecno,MRTecno,5 ago. 2016,FDA approves using genetically-modified mosquitos to fight Zika https://www.engadget.com/2016/08/05/fda-approves-using-genetically-modified-mosquitos-to-fight-zika/?utm_source=dlvr.it&utm_medium=twitter … #florida #geneticallymodifiedmosquitos #medicine,0,0,/MRTecno/status/761714069493600258,
1174,@newsroundcom,News-round.com,5 ago. 2016,"The Food and drug administration Just Approved Genetically Modified, Zika-Fighting Nasty flying bugs for Release in… http://www.newsy-today.com/the-fda-just-approved-genetically-modified-zika-fighting-mosquitoes-for-release-in-florida-fortune/ …",0,0,/newsroundcom/status/761705169402728449,
1175,@newsroundcom,News-round.com,5 ago. 2016,The Food and drug administration just approved genetically modified nasty flying bugs to battle Zika in Florida –… http://www.newsy-today.com/the-fda-just-approved-genetically-modified-mosquitoes-to-fight-zika-in-florida-the-verge/ …,0,0,/newsroundcom/status/761699664345178112,
1176,@TR_Health_Med,Health & Medicine,5 ago. 2016,"US approves GMO mosquito test, but no release imminent http://bit.ly/2aEOA1L  #health #medicine",0,0,/TR_Health_Med/status/761690013851525120,
1177,@Sierra147Sierra,Russell Sierra,5 ago. 2016,"FDA Approves Genetically Modified Mosquitoes For Release In Florida: Today, the U.S. Food And Drug Administra... http://tinyurl.com/gvm7ne2",1,1,/Sierra147Sierra/status/761688592150179840,
1178,@josephdavisance,josephdavisance,5 ago. 2016,"FDA Approves Genetically Modified Mosquitoes For Release In Florida: Today, the U.S. Food And Drug Administra... http://tinyurl.com/gvm7ne2",0,0,/josephdavisance/status/761688567361904640,
1179,@glendaflemingo1,glendaflemingolds,5 ago. 2016,"FDA Approves Genetically Modified Mosquitoes For Release In Florida: Today, the U.S. Food And Drug Administra... http://tinyurl.com/gvm7ne2",0,0,/glendaflemingo1/status/761688544872058881,
1180,@notivagos,notivagos,5 ago. 2016,"US Approves GMO Mosquito Test, but No Release Imminent: The U.S. Food and Drug Administration has given final... http://migre.me/uzCOj",0,0,/notivagos/status/761688185919320064,
1181,@PinkSheepNews,Jhawn Paul,5 ago. 2016,The Food and Drug Administration gave the okay to a field trial to release genetically modified Zika-killing mosquitoes in the Florida Keys.,0,0,/PinkSheepNews/status/761670245778092032,
1182,@w4rma,Richard Anthony,5 ago. 2016,The U.S. Food and Drug Administration is giving final approval for a field trial releasing genetically modified... http://fb.me/2Utw95Vra,0,0,/w4rma/status/761664020105482240,
1183,@conchkid,Kevin Dale Sanders,5 ago. 2016,FDA Approves Keys Test Of Genetically Modified Mosquitoes: The U.S. Food and Drug Administration has approved... http://shrd.by/zvq8KO,0,0,/conchkid/status/761663208067399680,
1184,@conchkid,Kevin Dale Sanders,5 ago. 2016,Feds clear way for GMO mosquitoes in the Florida Keys: The Food and Drug Administration on Friday cleared the... http://shrd.by/YcZsW9,0,0,/conchkid/status/761663195555696641,
1185,@southbeach_buzz,South Beach Buzz,5 ago. 2016,Feds clear way for GMO mosquitoes in the Florida Keys: The Food and Drug Administration on… http://m.tbnn.it/LypzcS pic.twitter.com/Mnw5LZ1sBt,0,0,/southbeach_buzz/status/761657423325081600,
1186,@saveayear,#SaveAYear,5 ago. 2016,Florida cleared to release genetically modified mosquitoes in Zika fight: US Food and Drug Admin... http://bit.ly/2aZzPYa  #Environment,0,0,/saveayear/status/761649518077030400,
