,Usuario,Nombre,Fecha,Tweet,RT,like,path,verificados
736,@karma_jake,Jake Karma,31 ene. 2017,that's not government role and medicine won't fix heart disease the cause is the American diet GMO food,0,0,/karma_jake/status/826537634835079169,
737,@Alandavis37,Alan Davis,31 ene. 2017,@POTUS  needs to have investigation of medicine & vaccines which are causing many illness. GMO'S foods also,0,1,/Alandavis37/status/826475202762653696,
738,@RenardMoreau,Renard Moreau,30 ene. 2017,This Genetically Modified Salmonella Destroys Brain Cancer http://bit.ly/2kkH55b  #TraceDominguez #Science #Medicine #Cancer,0,0,/RenardMoreau/status/826206540730363905,
739,@AmeriCannaBlunt,AmeriCanna Blunt,30 ene. 2017,"DNA editing of meds is needed due to chemical warfare , vaccines & GMO foods 
So, 
Yes It will change medicine https://twitter.com/orsini70/status/826157494489722881 …",2,2,/AmeriCannaBlunt/status/826157997936275457,
740,@FOSSquared,FOS Squared,30 ene. 2017,"When Hippocrates said that your food is your medicine, the pesticides, herbicides and GMO did not exist! 
#Organic #NoGMO #finefoods #London",0,1,/FOSSquared/status/826048015613845505,
741,@Fabrico5,FAB5 RealityCheckUSA,29 ene. 2017,"@TANSTAAFL24 ALL GMO FREE FOOD IS MY MEDICINE, I SEE WHY YOU STRUGGLE WITH #FACT DO NOT USE #BigPharma ITS FRYING UR BRAIN",0,0,/Fabrico5/status/825744294594101248,
742,@XCapgroup1,XCap Insights,29 ene. 2017,"Genetically modified cells just cured two babies with Leukemia.
http://buff.ly/2kHzlqE 
#medicine #crispr #geneediting #biotech",1,2,/XCapgroup1/status/825704991759417344,
743,@exposeconspirac,expose conspiracy,28 ene. 2017,If GMO Fish Injected w/ STERILIZATION Drug before put in Lakes ... U R What U Eat,0,0,/exposeconspirac/status/825451552886239232,
744,@JerryDeLuca,Jerry De Luca,28 ene. 2017,13 Concise Reasons Why Mercola Is A Fraud …… #GMO …… #cancer ……. #medicine …… @CaulfieldTim  ……. http://www.mybestbuddymedia.com/2017/01/13-concise-reasons-why-mercola-is-fraud_27.html …pic.twitter.com/3p7HIEC1HA,0,1,/JerryDeLuca/status/825346192632483842,
745,@FlintboxUpdates,Flintbox,28 ene. 2017,Transgenic mouse model for antithrombotic drug development http://dlvr.it/NDBZwz,1,0,/FlintboxUpdates/status/825143119041605632,
746,@marcslate8,Marcus Slate,27 ene. 2017,"$100M 2 FDA?-Effort Control Drug Patents/Cost+Assoc of Clinton FDN,Cabal in USDA using MON-Co:GMO-N-oids Seeds-2 control Food/Costs-OBJECT-$",1,0,/marcslate8/status/825096548803416064,
747,@reallabwives,Real Labwives,27 ene. 2017,"“If #DNA is a drug, then all life on Earth is high.” FDA's decision on whether to make #CRISPR a #GMO...troubling http://gizmodo.com/the-fdas-newly-proposed-gmo-rules-are-nonsense-1791519749 …",0,0,/reallabwives/status/825025426632302593,
748,@PaulBMcGill,Paul McGill,27 ene. 2017,"Regonal GMO Free, pretty blunt tool @FoxMarama. Food has GMO. Medicine too. Why not let growers have a choice too if available?",0,1,/PaulBMcGill/status/824880871186370560,
749,@aweichselbaum,Andreas Weichselbaum,26 ene. 2017,Very interesting read on bacteria that are genetically modified to deliver drug! #biotech http://www.nature.com.proxy.readcube.com/nm/journal/v23/n1/full/nm0117-5.html?token=2blIveKXTbfpXA5xSbL+oudQkIN4RqKG7zp+yfFhL6zWQ1dnAMoh0DvuHvXwoIHr&referrer_url=http://www.nature.com/articles/nm0117-5.epdf?shared_access_token=BKQJg6E6Du9hCXrNMvzRG9RgN0jAjWel9jnR3ZoTv0MavN3yB0RyjvvGK1ZESe0DWcTYleL7sJvnMrIVbuZRvLZgFQ_MKR5PpZJ_SafjosCJZp0z6x8XsQ9wltGr7X4UVjRn6_QAV5EiYJg18eGYtPQMRQevzM3ez0q1ioQpdZo%253D …,0,0,/aweichselbaum/status/824625441671680002,
750,@ClaudiaHirawat,Claudia Hirawat,26 ene. 2017,"Exciting! There could be vaccine booths, GMO enhanced snacks, lessons on how to read the label of a drug! Oh this could be awesome! https://twitter.com/cnn/status/824423109184909313 …",1,1,/ClaudiaHirawat/status/824462685400158208,
751,@PittsburgMike,MikeMovesPittsburgh,25 ene. 2017,Mad Science: ‘Genetically Modified Micro Humans’ to be ‘Farmed’ for Drug Testing by 2017 http://naturalsociety.com/gm-micro-human-farms-replace-animal-testing-within-three-years/ … via @naturalsociety,0,0,/PittsburgMike/status/824282330508496897,
752,@VBayes,val bayes,25 ene. 2017,"“If DNA is a drug, then all life on Earth is high.” The FDA's Newly Proposed #GMO Rules Are Nonsense http://gizmodo.com/the-fdas-newly-proposed-gmo-rules-are-nonsense-1791519749?utm_medium=sharefromsite&utm_source=Gizmodo_twitter … via @gizmodo",1,4,/VBayes/status/824076575650017281,
753,@eyes_wide_open1,Freedom of Speech,24 ene. 2017,"5 out 29 chapterson trade. Rest was internet censorship,fracking,drug prices sky high, GMO no labelling, utilities, banksters rule https://twitter.com/richardtuffin/status/823704273477193729 …",0,0,/eyes_wide_open1/status/824017032324648960,
754,@tmullin22,Tim Mullin,24 ene. 2017,"OMG? No, GMO. This is about protecting nefarious characters in the already barely regulated food & drug industry.",0,0,/tmullin22/status/823996690935980034,
755,@johnpaul247,johnpaul247,24 ene. 2017,"""Animal drug""?? Sorry #FDA this is absolute non-sense. #GMO  http://google.com/newsstand/s/CBIwivetqzk …",0,0,/johnpaul247/status/823925019298435073,
756,@davidurbano,Curious Astronaut,24 ene. 2017,"So the meat McDonald's uses 100% pure USDA inspected beef w/ no additives, no fillers, no extenders not a drug & has no GMO's?",0,0,/davidurbano/status/823923579381280769,
757,@IRTnoGMOs,responsibletechnology.org,24 ene. 2017,"Synagis is a drug created using recombinant DNA, which is another way to say GMO.  Some doctors are pushing hard... http://fb.me/4QzabVdsJ",4,3,/IRTnoGMOs/status/823921093807374336,
758,@maniac_cn,48hnews,24 ene. 2017,Food and Drug Administration: good crown home non genetically modified soybean oil and other 4 batches of substandard foodhttp://48h.news/2…,0,0,/maniac_cn/status/823836782198489088,
759,@BMartinovski,bilyana martinovski,24 ene. 2017,"drug abuse, GMO, CNN, sugar abuse, coffee abuse, Hollywood, pornography, promiscuity, computer games... :-)",0,1,/BMartinovski/status/823706171701915648,
760,@Mungo_5,"I, Mungo number 5, a genius:",23 ene. 2017,@SKZCartoons @BIUK_Politics US deal = mislabelled drug- & hormone-laced GMO food that currently we can't legally give to a pig,0,3,/Mungo_5/status/823488921371820032,
761,@SGuptaMD,Dr. Sameer Gupta,23 ene. 2017,Why Is Genetically Modified Organisms The Future Of Medicine? https://youtu.be/gA8SUrIUyy8  via @YouTube,0,0,/SGuptaMD/status/823476766228365313,
762,@NoGMOsVerified,NoGMOsVerified,23 ene. 2017,New England Journal of Medicine Article Calls for GMO Labels on Foods #GMOs #RightToKnow #GMO /fd http://dld.bz/dR8YC,2,0,/NoGMOsVerified/status/823351857976410114,
763,@Stop_GMO_Canada,Stop GMO Canada,22 ene. 2017,"What if hospitals took the ultimate step in preventative medicine: bringing healthy, organic food right to their... http://fb.me/18GnhhZhP",0,0,/Stop_GMO_Canada/status/823318034223808512,
764,@Stop_GMO_Canada,Stop GMO Canada,22 ene. 2017,"Organic Food is the Best Medicine, and a Pennsylvania Hospital Agrees http://www.organicauthority.com/organic-food-is-the-best-medicine-and-this-hospital-agrees …",0,0,/Stop_GMO_Canada/status/823317669466152961,
765,@StubCrouch,Patrick  🇪🇺,22 ene. 2017,"We will be ""open house"" to GMO's, Fracking, Relaxation of Drug Laws. That's the UK ""taking back control""? Ho ho!",0,1,/StubCrouch/status/823197979662319618,
766,@AdriOnFilms,Adrianne McClelland,22 ene. 2017,"in other words, Monsanto, GMO foods, PROFITS over PEOPLE! At least the drug companies will make money off it. Now 1 in same",0,0,/AdriOnFilms/status/823044017717936128,
767,@yourmahnster,Mahnisms,22 ene. 2017,The more GMO products that are consumed the sicker & fatter Americans get. Let's not line the pockets of drug companies & Monsanto! #noGMOpic.twitter.com/avU81AxwXm,0,0,/yourmahnster/status/822972782170476544,
768,@SGuptaMD,Dr. Sameer Gupta,21 ene. 2017,"Pleasure meetng #NobelPrize #medicine 1993, Sir Richard Roberts 2 discuss #GMO;Food more imp than medicine #GMOhere2stay #DoctorsonCallNDTVpic.twitter.com/Jep5RB9bBi",1,1,/SGuptaMD/status/822877198763708416,
769,@kenjaques,Ken Jaques,20 ene. 2017,"Eventually science will solve GMO, glyphosate, vaccine & other debates and will figure out how and why ""non-conventional"" medicine works. https://twitter.com/CaulfieldTim/status/822585884952379395 …",1,2,/kenjaques/status/822592070430900224,
770,@NoGMOsVerified,NoGMOsVerified,20 ene. 2017,Drug-Resistant bug Klebsiella Causes Worry #GMOs #GMO http://NoGMOsVerified.com  /fd http://dld.bz/ech7R,0,0,/NoGMOsVerified/status/822571709467332608,
771,@TheVictoryBell,Buckeye  🚨 🇺🇸,20 ene. 2017,#ThankYouObama for not banning GMO's or legalizing marijuana (or even changing it from a schedule 1 drug) like you said you would.,0,0,/TheVictoryBell/status/822334570808901632,
772,@TRANSIND,NarayanBond,20 ene. 2017,"VOODOOSCIENCE MODERN MEDICINE IS BANE OF THIS EARTH !
iT REQUIRED GMO FOOD , JERSEYMILK , FACTORY EGGS ! http://fb.me/1L43V6L4p",0,0,/TRANSIND/status/822302160058654720,
773,@StuartSwansons,Freedom ofthe Spirit,19 ene. 2017,"Anything #corn  is genetically engineered to slow you down #GMO  is poison not medicine, I want #Health to give back to people in #love",0,1,/StuartSwansons/status/822157445745221633,
774,@JulioCuevasJC,JayCeePR,19 ene. 2017,'muricans are GMO poisoned Big Pharma Drug addled idiots.lmao,0,1,/JulioCuevasJC/status/822053391471935488,
775,@FarmFairyCrafts,Farm Fairy Crafts,19 ene. 2017,"Food Can be Medicine or Poison. Your Body, Your Choice.  #GMO pic.twitter.com/abTwdMnKSj",1,1,/FarmFairyCrafts/status/821928958283444230,
776,@sean_nesmith,sean 💫 🌟 ✨,18 ene. 2017,"taking perscribed medicine has been the worst experience for me!! in the mood to go all vegan, organic, non GMO, gluten-free, you name it",0,3,/sean_nesmith/status/821552692975849482,
777,@Earth_Patriot,VikkiTaylorCummings,17 ene. 2017,"GMO Cannabis from BIG PHARMA DRUG CARTELS 
KILLS PEOPLE ON PURPOSE...
#tommysgarage #earthpatriot #drugs... http://fb.me/8f8G8mYVK",0,0,/Earth_Patriot/status/821484277489696768,
778,@TX123512,_k_123,17 ene. 2017,"I really wish you could ban aluminum in medicine, beauty products and #gmo @thedonaldtrump",0,0,/TX123512/status/821404259237306368,
779,@NiceGuy504,NG504,17 ene. 2017,"Where were you angry people when Obama was breaking every law on record? Protected GMO @MonsantoCo , Sold weapons to drug cartels?",2,2,/NiceGuy504/status/821378627073937409,
780,@kitzfuhel,Kits Fool and 1000s of others,16 ene. 2017,"In Bank's Culture, citizens genetically modified 4 birth control, have ""drug glands"", & often change sexes 4 fun.",0,0,/kitzfuhel/status/820859963312476161,
781,@Cholerajoe,Maxwell Edison,15 ene. 2017,There are hundreds of life-saving medications produced using GMO's. Every molecule of insulin and any drug ending in -ab.,1,5,/Cholerajoe/status/820680834697068545,
782,@ShortLawyer,Short Lawyer Person,15 ene. 2017,I wish the Democrats could be the party of science. But the whole GMO/alternative medicine angle ruins it.,0,0,/ShortLawyer/status/820425844980060160,
783,@DinaJon60818043,Dina Jones,14 ene. 2017,"Why is it drug prices & poor quality is only in North America, even Afric,India, Japan eg. don't want drugs or GMO's. https://twitter.com/margo94/status/820319661812305920 …",0,0,/DinaJon60818043/status/820385432164630528,
784,@beachvetlbc,Notorious KGB Aggie,14 ene. 2017,All GMO studies are performed on animals. Your blog's written by incompetents in veterinary medicine @agronomistag @songberryfarm @gmjochum,0,0,/beachvetlbc/status/820367173231120384,
785,@YinYangCab,YinYangCab,14 ene. 2017,"Better late than never. Drs should be educated in holistic medicine, dangers of Genetically Modified Food & Lepitin Resistance Inflammation. https://twitter.com/cbsnewyork/status/820125156077162497 …",0,0,/YinYangCab/status/820128615039987713,
786,@jonathancornick,Jonathan Cornick,13 ene. 2017,"I’m a lib. Hear plenty of depressing alt. medicine, GMO, vaccine nonsense from ‘educated’ UWS/UESers in NYC.",1,3,/jonathancornick/status/819765712201846784,
787,@FlyersF1,BEN-JAMMIN  🦅 🇺🇸,12 ene. 2017,@RT_America shut down those anti human eugenics scum with their gmo and drug resistant seeds n crap,0,1,/FlyersF1/status/819602446087503874,
788,@ibrbxx,🐀 D-Rail  🐀,12 ene. 2017,@nutella @latelateshow tobacco is fine though? alcohol weed GMO'S...... really food and drug agency's? really? pic.twitter.com/6VJOAxWO2i,0,0,/ibrbxx/status/819376440617668608,
789,@HauteAristocrat,GLUTENFREE©,11 ene. 2017,"The food and drug administration takes bribes under the table so if you have a GMO food you want added on the list as ""FDA Approved"" pay up",1,0,/HauteAristocrat/status/819258345278218240,
790,@davelisterscrak,david lister,11 ene. 2017,a vaccine is an inert version of the virus cultured in eggs. It is not a drug.Also GMO's are perfectly safe. Read more,0,0,/davelisterscrak/status/819182314295009280,
791,@pololinzo,Timbuktu,10 ene. 2017,GMO preemptive medicine preemptive dope heads #Multiple #fronts Isis infiltrated us… https://www.instagram.com/p/BPGY1P3DlNi/,0,0,/pololinzo/status/818940380343312384,
792,@GMO_Duh,Guillermo,10 ene. 2017,I just want to practice medicine already,0,1,/GMO_Duh/status/818921287259078656,
793,@JaYO_641,thatboiJay.Aye.whY.,10 ene. 2017,so when the tribe does vote on that don't be surprised on the medicine being grown by shady growers and using gmo products,0,0,/JaYO_641/status/818883080031182852,
794,@BryantMardy,Mardy Bryant,10 ene. 2017,"Let organic non GMO foods be your medicine and allow Mother Nature to be your hospital.
#FitForLife 
-Mardy Bryant http://fb.me/Z31cu2R5",0,0,/BryantMardy/status/818844795389038593,
795,@8extremes,8extremes,7 ene. 2017,"Drug & Vaccine Co's
Blatantly FALSIFY
Govt IGNORES Safety Concerns
Just Like GMO & Tobacco
Learn
SO U can Avoid
http://tinyurl.com/jzwffaq pic.twitter.com/bZqCxiFinH",7,6,/8extremes/status/817805330755121152,
796,@ReflectiveMedic,Will Smith,7 ene. 2017,#new #blog #medicine #gmo #GMOs #food You can find the post here: http://medblog.medlink-uk.net/reflectivemedicblog/2017/01/07/gmo/ …,0,0,/ReflectiveMedic/status/817779542945386497,
797,@coryhamel,Cory Hamel,6 ene. 2017,"@RachelsNews GMO insulin has been safe and effective for 40+ years, do you think it's wise to imply that life saving medicine is ""toxic""?",0,0,/coryhamel/status/817416961839616000,
798,@paxlynx,paxlynx,6 ene. 2017,"A Genetically Modified Malaria Vaccine Has Passed an Important Hurdle
http://bit.ly/2iLWoRb  #medicine #science",0,0,/paxlynx/status/817395972896673792,
799,@TheonlyFunkyOne,Funky Dude,4 ene. 2017,"#Artificial, unnatural & #GMO #food & additives cause #harm #cdnpoli #Pharmaceutical #drug #greed #corporate #health #kids #life #naturehttps://twitter.com/AFP/status/816593518214914048 …",1,2,/TheonlyFunkyOne/status/816598655994130432,
800,@VERNIVERN,VERNON BALMER JR.,4 ene. 2017,"2015 > The US government approves drug-producing “GMO” chickens        
http://inhabitat.com/the-us-government-approves-drug-producing-gmo-chickens/ …",0,0,/VERNIVERN/status/816444452893929476,
801,@katj_13,Katie 🎄 ⚓️,3 ene. 2017,"In ridells a second time in a row, one half of the class is talking about bad drug trips over break, the other about non GMO diets..
..woo?",0,1,/katj_13/status/816324298789027843,
802,@olivergburke,Oliver Burke,3 ene. 2017,Study Shows Major Molecular Differences Between GMO And Non-GMO Corn | Health/Medicine |http://Axisoflogic.com  https://shar.es/1DiGvS pic.twitter.com/2EFcKocvJi,0,1,/olivergburke/status/816276429595901952,
803,@beachvetlbc,Notorious KGB Aggie,2 ene. 2017,So scientists with vested interests in promoting GMO merchandise with no credibility in medicine assuring us its safe @PamelaDrew @jmmulet,1,3,/beachvetlbc/status/816007453389115392,
804,@beachvetlbc,Notorious KGB Aggie,1 ene. 2017,"Well, ur in luck then, because I do have expertise in animal medicine & GMO animal studies <= raising PROFOUND SAFETY issues.",0,0,/beachvetlbc/status/815684220563525634,
805,@FarmFairyCrafts,Farm Fairy Crafts,1 ene. 2017,"If Food is Medicine, & for FDA Approval Medicines Go Through Clinical Trials, Why is #GMO Food Treated Differently w/o Requiring Trials?",2,8,/FarmFairyCrafts/status/815588704949518336,
806,@kyleisonline,"what the FUCK is up kyle? no, what did you say? wh",30 dic. 2016,everything is genetically modified all of ur food is and ur dog is and ur medicine is just please fucking study what GMOs are,0,1,/kyleisonline/status/814855038170464256,
807,@NegusHamitic,Baby Algebra Toys,29 dic. 2016,war on pollution #ClimateChangeIsReal #gmo the real drug,0,0,/NegusHamitic/status/814741711901470720,
808,@MiVa28052832,Mi Va,29 dic. 2016,@MADE__USA Please do something about gmo poisoning our food . Our food is our mediine and our medicine is our food https://www.youtube.com/watch?v=H62ScHZkTXw …,0,0,/MiVa28052832/status/814389325819363329,
809,@MadSciKat,Nasty Science Pussy,28 dic. 2016,7 bad #science and #health ideas that should die with 2016 http://www.vox.com/2016/12/26/14005484/bad-science-health-myths-dead …  #BadScience #climate #gmo #medicine #psych,0,1,/MadSciKat/status/814154171742097409,
810,@WorldTruthTV,WorldTruth.TV,28 dic. 2016,‘Genetically Modified Micro Humans’ to be ‘Farmed’ for Drug Testing by 2017 http://worldtruth.tv/genetically-modified-micro-humans-to-be-farmed-for-drug-testing-by-2017/ …,3,0,/WorldTruthTV/status/814142855245598720,
811,@JaneStanley64,Jane Stanley,27 dic. 2016,"Another FDA approved drug doing more harm, Legalize cannabis and no to the governments GMO cannabis. http://fb.me/5tAerBUmF",0,0,/JaneStanley64/status/813836805367889921,
812,@PLTC_PastLives,"PastLifeTherapyCenter, @DrThomasPaul",27 dic. 2016,#BigPharma strikes again. When is everyone going to learn that #medicine is mostly a #criminal operation. #gmo #CDChttp://www.dailymail.co.uk/news/article-4068738/Garry-Shandling-death-caused-blood-clot-oxycodone-hydrocodone-according-autopsy-report.html#ixzz4U48SXynx …,36,32,/PLTC_PastLives/status/813818863397654528,
813,@celiacrecovery,Celiac Recovery,26 dic. 2016,#India's #GMO #suicide rate overshadows the drug #problem #GMO #Cotton https://www.youtube.com/watch?v=RLHqu0eMhZs&sns=tw … via @youtube,0,0,/celiacrecovery/status/813542373674385408,
814,@dyctiostelium,Irma Aguilar-Delfin,26 dic. 2016,"Autologous but genetically modified skin grafts for epidermolysis bullosa, innate collagen disease. Neat #medicine.
https://www.technologyreview.com/s/603167/gene-therapy-offers-hope-for-worst-disease-youve-never-heard-of/ …",0,0,/dyctiostelium/status/813473201338667008,
815,@FarmFairyCrafts,Farm Fairy Crafts,25 dic. 2016,"If Food is Medicine, & for FDA Approval Medicines Go Through Clinical Trials, Why is #GMO Food Treated Differently w/o Requiring Trials?",2,9,/FarmFairyCrafts/status/813251278495158272,
816,@SkipHatos,Skip Hatos,25 dic. 2016,"I'm so sorry. The food and drug industry hide a lot of truths. Bread immediately turns to sugar, GMO's are frankenfood",1,1,/SkipHatos/status/813077144695869440,
817,@8extremes,8extremes,24 dic. 2016,"Drug & Vaccine Co's
Blatantly FALSIFY
Govt IGNORES Safety Concerns
Just Like GMO & Tobacco
Learn
SO U can Avoid IT
http://tinyurl.com/jzwffaq pic.twitter.com/hyJYEsRfuH",6,3,/8extremes/status/812732857164541952,
818,@FarmFairyCrafts,Farm Fairy Crafts,23 dic. 2016,"Food Can be Medicine or Poison. Your Body, Your Choice.  #GMO pic.twitter.com/QX0YHUHN5s",5,6,/FarmFairyCrafts/status/812568272071749632,
819,@uniquerebel86,unique rebel,23 dic. 2016,"GMO kills too. Monsanto getting rich & pharmaceutical drug cartels, making a killing. Low dealers, not paying tax are doing years in jail pic.twitter.com/Ln9YZoXqUf",0,0,/uniquerebel86/status/812295631758827520,
820,@GMO_Duh,Guillermo,22 dic. 2016,"Had a drug test the 16th and thought I passed it
 I got called in for a second screening but I got high yesterday and now I'm tripping hard",0,0,/GMO_Duh/status/812113098077130752,
821,@FishingwithMS,OffBalance,22 dic. 2016,"Every advanced country in the world has a problem with GMO's, ecept the US @FDA_Drug_Info",0,0,/FishingwithMS/status/811978876524068864,
822,@EwanWBeauty,beyond Nefer LLC,22 dic. 2016,"Hotep Family. LET ORGANIC PLANT BASED NONE GMO FOODS BE THY MEDICINE, AND MEDICINE THEY FOOD.… https://www.instagram.com/p/BOUWUQvgemV/",0,0,/EwanWBeauty/status/811897973051453440,
823,@KrystalMonique_,krystal,20 dic. 2016,Now there's a vaccine for diabetes. When the medicine they're prescribing us causes diabetes and also the GMO's they're feeding us.,0,0,/KrystalMonique_/status/811273685269155840,
824,@NOtoGMOs,Protect Nature,19 dic. 2016,"#GMO can do good in medicine, but absolutely not necessary or needed in food.",0,0,/NOtoGMOs/status/810857159747600384,
825,@ChristaBadeaux,Christa Badeaux,19 dic. 2016,But will ONLY eat and drink organic GMO free foods/beverages and will only use natural holistic medicine,0,0,/ChristaBadeaux/status/810795724501897216,
826,@Billsuperbowl,.BuffBills,17 dic. 2016,"Just label it. #GMO @US_FDA @FDA_Drug_Info @BillGates @GeraldoRivera @ABC @NBCNews @alj
http://www.justlabelit.org/",0,0,/Billsuperbowl/status/810309537626521600,
827,@Billsuperbowl,.BuffBills,17 dic. 2016,Stop the #GMO movement @MSNBC @FDA_Drug_Info @CoryBooker @JohnFugelsang @TalibKweli @nytfood @USDA @FoxNews @CNNhttp://responsibletechnology.org/10-reasons-to-avoid-gmos/ …,0,0,/Billsuperbowl/status/810296211055976448,
828,@Boris_Patriot,BorisRussian Patriot,16 dic. 2016,"family= Mom and Dad.Not 2 moms or dads, or no kids.The masters want drug fucked consumers eating GMO paying off loans 4ever",0,0,/Boris_Patriot/status/809753211292651520,
829,@NeoRenfield,NeoRenfield,15 dic. 2016,Abusing Science You Don’t Understand http://theness.com/neurologicablog/index.php/abusing-science-you-dont-understand/ … #science #GMO #antiGMO #ideology #insulin #medicine #genetics #diabetes,0,1,/NeoRenfield/status/809491775400255489,
830,@RichardRSchult1,Richard R. Schultz,15 dic. 2016,":Well then, You show great wisdom & a promising future.""Let thy food be thy medicine"",non gmo processed poisoned etc, yes pic.twitter.com/DXCxuF88mS",0,0,/RichardRSchult1/status/809408622019170306,
831,@alyssaaross,Alyssa Aros,14 dic. 2016,It's legal now the government controls the weed they're making cbd a section 1 drug which is mostly for pain. Probs GMO weed,0,0,/alyssaaross/status/809224674248826880,
832,@EcoTort,EcoTort,14 dic. 2016,"What is Wrong with GMO Cannabis? - Too early to tell, and that is the problem. The medicine people have been... http://fb.me/1yROR7zoP",0,0,/EcoTort/status/809184022664462336,
833,@sixslices75,GoshaGary,13 dic. 2016,"People have been fed propaganda for years. Hate weed because it's ""a drug"" but will happily eat this gmo infested food https://twitter.com/moeses_/status/808708614240239616 …",0,0,/sixslices75/status/808709017489047552,
834,@sisboombahbah,Yenrap Rellin,13 dic. 2016,GMO's yes.  Medicine?,0,0,/sisboombahbah/status/808651688680849408,
835,@GadgetsMagz,Gadgets Magazine,12 dic. 2016,Gadgets Magazine Olympic Drug Cops Will Scan for Genetically Modified Athletes It took a decade from http://gadgetsmagz.com/?p=5462,0,0,/GadgetsMagz/status/808269486814072832,
836,@askdeedra,SolOrientedLeader,12 dic. 2016,I nominate any of the #GMO company CEOs to head the Food & Drug Administation #cabinetpicks,0,0,/askdeedra/status/808233937264742401,
837,@agucova,Agustín Covarrubias,11 dic. 2016,gene modification has saved countless lives. Going from GMO's to medicine.,0,1,/agucova/status/808130203100868612,
838,@FarmFairyCrafts,Farm Fairy Crafts,11 dic. 2016,"If Food is Medicine, & for FDA Approval Medicines Go Through Clinical Trials, Why is #GMO Food Treated Differently w/o Requiring Trials?",2,3,/FarmFairyCrafts/status/808051050242523136,
839,@CORMEDICO,COR-MEDICO MD.,11 dic. 2016,"Yes it was. And it has been proven and admited, albeit a little late. But better late than never. #GMO #medicine 
http://www.ecowatch.com/genetically-engineered-crops-2129791725.html …",0,1,/CORMEDICO/status/807888317752766465,
840,@NoGMOsVerified,NoGMOsVerified,10 dic. 2016,New England Journal of Medicine Article Calls for GMO Labels on Foods #GMOs #RightToKnow #GMO /fd http://dld.bz/dR8YC,0,0,/NoGMOsVerified/status/807804424664076288,
841,@realnewsvideos,WingzTV,10 dic. 2016,#Olympic #Drug Cops Will Scan #Genetically Modified Athletes http://wingztv.com/video/tribulation-news-man-high-on-drugs-punches-cop-through-glass …,0,0,/realnewsvideos/status/807625937055457280,
842,@SDSyd,cindy miller,10 dic. 2016,"look up the black hills area and their receptiveness to no GMO , holistic medicine, fair trade organics... Rapid city, SD",0,1,/SDSyd/status/807560543896674304,
843,@HarperKingsley0,ChangingMyNameAgain,9 dic. 2016,genetically modified crop passing some medicine-resistant sickness to the populace is a real fear. Especially since we've all seen the /5,0,0,/HarperKingsley0/status/807494347545415680,
844,@blamelewis,Tim Reid,9 dic. 2016,The Seralini GMO Study – Retraction and Response to Critics (Science-Based Medicine) http://sciencebasedmedicine.isomnia.co.uk/the-seralini-gmo-study-retraction-and-response-to-critics-2/ …pic.twitter.com/J2RFLhp6FA,0,0,/blamelewis/status/807370067415592961,
845,@rdivia,DivyaET,9 dic. 2016,"We should stop scare mongering of GMO crops, says Richard Roberts 1993 Nobel laureate for medicine at #NobelDialogue #FutureofFood #sialumni",4,3,/rdivia/status/807167037441183744,
846,@NoGMOsVerified,NoGMOsVerified,8 dic. 2016,Drug-Resistant bug Klebsiella Causes Worry #GMOs #GMO http://NoGMOsVerified.com  /fd http://dld.bz/ech7R,0,0,/NoGMOsVerified/status/807049422240616453,
