,Usuario,Nombre,Fecha,Tweet,RT,like,path,verificados
0,@maverick4pa,mark brown,11 dic. 2017,"YES!  A Clear and Consumer Friendly GMO disclosure standard!
I still am shocked everyday that medicine was basically unaware of
the ^AB Hx=^risk of many diseases! And that Glyphosate is an AB!
And they say GMOs+AB+hormones etc are fine in our food supply. https://twitter.com/justlabelit/status/940190737815232512 …",0,0,/maverick4pa/status/940262220574978048,
1,@alzheimers_bio,Alzheimers News,11 dic. 2017,#alzheimers Sensory Neurons from Tau Transgenic Mice and Their Utility in Drug Screening.: Tau misfolding is a major cause of neurodegeneration tauopathies being a growing group of diseases in which tau forms insoluble aggregates best known in Alzheimer… http://bioportfol.io/Q5NSHq,0,0,/alzheimers_bio/status/940156477993508864,
2,@TheDrugStores,TheDrugStores,11 dic. 2017,"#ReTweet #MostLiked #WeightLoss  http://amzn.to/2jiKeUJ  NatureWise CLA 1250, High Potency, Natural Weight Loss Exercise Enhancement, Increase Lean Muscle Mass, Non Stimulating, Non GMO 100% Safflower Oil, Gluten pic.twitter.com/GUrwlw8wO8",0,1,/TheDrugStores/status/939985198804094976,
3,@AutophagyPapers,Autophagy Papers,11 dic. 2017,Sensory Neurons from Tau Transgenic Mice and Their Utility in Drug Screening. http://dlvr.it/Q5Jv7p pic.twitter.com/N3lARCBYWd,0,0,/AutophagyPapers/status/939969539764207616,
4,@crvallotton,Diagnosis my RIGHT!,10 dic. 2017,"Hi five both hands to #Brazil Let thy food be thy medicine.
North America our government refuses to label our food. #GMO @justlabelit people are getting sicker and sicker.
#Greed at the expense of human lives.https://twitter.com/healthranger/status/939495813285326850 …",1,1,/crvallotton/status/939897309415997440,
5,@FrillyHyena,Andrew Thomas,10 dic. 2017,"my life depends on a GMO. It also depends on said GMO's owners not being utter tools and raising the cost of the drug in question, but rich people dun care about the rest of us.",0,4,/FrillyHyena/status/939784018404392961,
6,@FarmFairyCrafts,Farm Fairy Crafts,10 dic. 2017,"If Food is Medicine, & for FDA Approval Medicines Go Through Clinical Trials, Why is #GMO Food Treated Differently w/o Requiring Trials?",1,0,/FarmFairyCrafts/status/939726454635429888,
7,@5Strat,John Salisbury,8 dic. 2017,"opiates = drug
anti-depressants = drug
booze = drug
cigarette = drug
caffeine = drug
refined white sugar = drug
GMO = drug
Time for America to get healthy and reject the drugs that are killing not only our bodies but our ability to reproduce our species. What's in your body?",1,2,/5Strat/status/939270291196223488,
8,@BrewThruu,Sara,8 dic. 2017,I used Chubbs pee to pass a drug test one time and she said “here goes your vegan organic non gmo pee let people know”,0,1,/BrewThruu/status/939237426320457728,
9,@GStoneSociety,Greenstone Society,8 dic. 2017,"Right now you'll find holiday specials on #GMO, #SkywalkerOG, #KosherDawg, #PurplePeopleEater, and a few more of your favorite flowers!
Check the menu > https://greenstonesociety.com/menu/  #AnnArbor #Cannabis #Medicine #THC #Marijuanapic.twitter.com/bTLxghUpoR",0,1,/GStoneSociety/status/939219293715169281,
10,@FarmFairyCrafts,Farm Fairy Crafts,8 dic. 2017,"Food Can be Medicine or Poison. Your Body, Your Choice.  #GMO pic.twitter.com/PfSk2L9nWd",2,1,/FarmFairyCrafts/status/938977510506852352,
11,@scimedsolutions,SciMed Solutions,7 dic. 2017,80% of Patient's Skin Replaced With Genetically-Modified Grafts  http://bit.ly/2iTe1TA  @discovermag #biotech #medicine #stemcells #sciencepic.twitter.com/QjdQnc2luT,0,0,/scimedsolutions/status/938652557672701959,
12,@NoGMOsVerified,NoGMOsVerified,6 dic. 2017,The New England Journal of Medicine Asks FDA to Reconsider Labeling GMO Foods #GMOs #RightToKnow #GMO /fd http://dld.bz/dRTYm,1,0,/NoGMOsVerified/status/938440342453522432,
13,@MRCHarwell,MRC Harwell,6 dic. 2017,"Apply for Genome Editing Mice for Medicine: http://bit.ly/GEMMCall , a bespoke genetically modified mouse service to advance understanding of human diseases @The_MRC #CRISPRpic.twitter.com/HkRfokLOSA",12,5,/MRCHarwell/status/938362116502949888,
14,@GMOFreeUSA,GMO Free USA,4 dic. 2017,"Great new book that should be on our AmazonSmile holiday shopping lists! Written by MIchelle Perro, MD, a pediatrician with over 35 years of experience in acute and integrative medicine. https://smile.amazon.com/ pic.twitter.com/HhifMULxon",3,7,/GMOFreeUSA/status/937716810845171712,
15,@stranger_poetry,stranger,3 dic. 2017,"Medicine is turned against the many as the NWO requires only half billion docile genetically-modified wage-slaves
Genocide began after WW2 killed too few
Sprayed Merck weaponised Brucella mycoplasma compromises immune system  so folks die of all kids of illnesses
COVERT GENOCIDE pic.twitter.com/NJ7mdPmygg",2,2,/stranger_poetry/status/937406957203480582,
16,@Chromtoday,Chromatography Today,3 dic. 2017,A recent study carried out by the University of California San Diego (UCSD) School of Medicine has found that human exposure to glyphosate has increased significantly since genetically modified crops were introduced  https://www.chromatographytoday.com/news/lc-ms/48/breaking-news/is-glyphosate-exposure-on-the-up-mdash-chromatography-investigates/44512 … #farming #gm #gmfoodpic.twitter.com/kAZconJskh,10,5,/Chromtoday/status/937237635642396674,
17,@FgBrown01,Fraser Brown,1 dic. 2017,"Okay, 1) The point of medicine is to keep people alive, and that is th job that doctors sign up for. The reasons they don’t prescribe alternative medicine is because they are not medicines. 
2) IDEK how you jumped to gmo’s but, we know they don’t have nasty side effect on people-",0,0,/FgBrown01/status/936406189738401792,
18,@gmo_crops,GMO Crop News,1 dic. 2017,#GMO news: 22nd Century Ships 2.4 Million SPECTRUMÂ Cigarettes for the National Institute on Drug Abuse http://ow.ly/lc7L50ft94h,0,0,/gmo_crops/status/936385087796666368,
19,@Charles_Tellier,Charles Tellier,30 nov. 2017,"Yes, but... We simply can't afford to go full US-style agriculture with pesticides, GMO crops, hormones and drug-resistant diseases, etc. The planet can't take unsustainable agriculture. We need a new agriculture that can thrive despite climate change: http://www.fao.org/agroecology/en/",0,1,/Charles_Tellier/status/936366219342512132,
20,@UnitedPeopleSd,Sd,29 nov. 2017,"Not to mention
opioid addicts would be
illegals
associated w/being criminal drug addicts
night after night on the news were they ethnic minorities..
If Monsantos supplied
genetically modified seed for the heroin production from Afghanistan, our evil plans would be more complete.",0,1,/UnitedPeopleSd/status/935986082730168321,
21,@3bbe415fc0094cd,Cheryl Fowler,29 nov. 2017,"Think about this. FDA, food and Drug administration. Allows GMO foods that eventually cause catastrophic health issues, that then require dangerous pharmaceuticals to treat. Who do you think is DOUBLE DIPPING? #FDA",4,12,/3bbe415fc0094cd/status/935981663598804992,
22,@GStoneSociety,Greenstone Society,29 nov. 2017,"Our current inventory of killer prerolls includes GMO, Shipwreck Golden Goat, Glue Trap, and more! Check them out > https://greenstonesociety.com/menu/  #AnnArbor #Cannabis #Marijuana #Medicine #Preroll #GMO #Shipwreck #GoldenGoat #GlueTrappic.twitter.com/ZA91L0BYw7",0,1,/GStoneSociety/status/935972960581619712,
23,@ClarityAtTKCG,Lucy Mancini Newell,29 nov. 2017,"Transplant of genetically modified, #patient skin helps to address rare genetic disorder; results of first transplant remain positive after 21 months  https://buff.ly/2mPV7yn  #medicine #rarediseasepic.twitter.com/GYYAqx2K98",0,0,/ClarityAtTKCG/status/935923971421278209,
24,@OFFICIAL_ERRT,ERRT,29 nov. 2017,"Keck Medicine glad we are following one another.  It depends on what brand you smoke.  If you are going to smoke, smoke Organic Cigarettes.  Many of the big industry companies use chemical herbicides and pesticides made by Monsanto which cause cancer.  They also use GMO tobacco.",0,0,/OFFICIAL_ERRT/status/935918575780581376,
25,@OceanGrownTREEZ,OGT™  ♿,29 nov. 2017,"Philo. On the way bacc Gmo started talking to me bout taking over. I think every high drug dealer fresh off just making a big juug always has that ""take over talk."" Gmo kiccd it in Urbana primarily. Urbana was the neighboring city to Champaign where I live. There was two apt",1,5,/OceanGrownTREEZ/status/935905154284642305,
26,@HomeoReikiDogs,Local,29 nov. 2017,"I'm beginning to think so - what do we really know about them except that they change history, medicine and everything? Is gmo just a scare? Not sure though. :)",0,0,/HomeoReikiDogs/status/935871409447780352,
27,@BBFunk01,BaxterB,29 nov. 2017,"Yeah almost as bad as a blinker wearing, pro vaxxer, bug pharma drug peddling genetically modified fruit loop.",0,1,/BBFunk01/status/935868571460173825,
28,@RebeccaNesbit,Rebecca Nesbit,28 nov. 2017,Jules' Hoffmann's immunotherapy company went under because of the backlash against #GMcrops - the drug was produced in #gmo plants so investors worried patients wouldn't accept it. How's that for unintended consequences... #NobelSpain,4,3,/RebeccaNesbit/status/935444764492812288,
29,@DesertErrorist,D★Ǝ,28 nov. 2017,"why bring up the Israeli Secret Intelligence Service? The beast system hates medicine , thats why theyve genetically modified our food and outlawed Cannabis.",0,1,/DesertErrorist/status/935444257879547904,
30,@jim_herd,Jim Herd,28 nov. 2017,"You’re free to carry on living in your little SJW bubble. I don’t care. Accept everything you’re told by “experts”. Take every vaccine, eat nothing but GMO, swallow every drug you’re prescribed, believe every bullshit “study” the press reports on. Knock yourself out.",2,5,/jim_herd/status/935316194135105536,
31,@gmo_crops,GMO Crop News,28 nov. 2017,#GMO news: Food vaccines and medicine How plant scientists are changing the world http://ow.ly/D9jE50fplxO,0,0,/gmo_crops/status/935298231596126209,
32,@beachvetlbc,Notorious KGB Aggie,27 nov. 2017,"This loon blocked me from GMO-Unskeptical ""Science Based"" ??? Medicine when I posted Monsanto's Hammond study & highlighted the fact that he had to have flunked #Nephrology not to recognize the GROSS FLAWS in #Monsanto #Hammond NK603 #GMO ""safety assurance study"" https://twitter.com/thackerpd/status/935214058986528768 …",0,2,/beachvetlbc/status/935215529182224384,
33,@MammoniForever,Penelope Gallant,27 nov. 2017,Let's #Roundup the #facts…#Glyphosate is a #foodie nightmare. Monsanto stay away from our food! Here's more fearsome fodder that shows #GMO's mess w our #health: https://www.huffingtonpost.com/jeffrey-smith/genetically-modified-soy_b_544575.html … #allergies #infertility #cancer #science #research #genetics #soy #corn #medicine #hormones,0,1,/MammoniForever/status/935172816449802240,
34,@UnderdogKitties,we are  💞 =^..^=,27 nov. 2017,If the baddies go... how will the face of disease and medicine change in our world?  If we get back to heirloom veggies... the REAL food... and away from all of the gmo bullshit food... what diseases will vanish?,0,1,/UnderdogKitties/status/935064918486904832,
35,@Lovethebeach999,Iam Me  🇺🇸 +++,27 nov. 2017,"Stay healthy, avoid gmo, vaccine and allopathic medicine",0,2,/Lovethebeach999/status/935003679761059840,
36,@docsingleterry,Ian Doc Singleterry,27 nov. 2017,"Still Waiting For Alcohol, GMO, Drug Companies, and other toxic labels on all things consumed #howaboutthathttps://twitter.com/NBCLA/status/934949928903827457 …",0,0,/docsingleterry/status/934955223436615680,
37,@Sheeple101,Sheeple101,26 nov. 2017,They require Carbon Credits and Climate Change to complete their final game. The Paris Agreement needs to be totally taken apart now. Drug / GMO Corporations need to go with the Paris Agreement.,4,15,/Sheeple101/status/934777043270615040,
38,@Sheeple101,Sheeple101,26 nov. 2017,"I guess I will need to dig into this more. I am also being attacked by vaccine / drug / GMO pushers it's hard to keep up with everything.
We need to see that all this Climate Change, vaccines, GMO, Chemtrails, etc etc are all by the same families.",0,1,/Sheeple101/status/934721454507139072,
39,@TerminatorBarbi,God Is ~ I Am,25 nov. 2017,"I'm so glad to see this debate happening in public.
It's Good Medicine to help detox the  off #CNN's GMO grass aka #FakeNews
Wakey wakey  here's your",1,1,/TerminatorBarbi/status/934562727715946496,
40,@ABCDE2017,a1b2c3,25 nov. 2017,"It is rather obvious that some In the medical industry would rather prescribe a drug when what we need most is proper nutrition organic non gmo food and non starchy sugary foods.. I would love if my Dr would say ""let's try proper nutrition b4 I have to prescribe something"".",1,1,/ABCDE2017/status/934550743662592000,
41,@xetrixa,XETRIXA,25 nov. 2017,"How did our ancestors survive without GMO's, insulin, modern medicine, surgery and vaccines? They didn't.",0,0,/xetrixa/status/934541272206979074,
42,@kwentoka,NathanCarlo「アントゥキン バタ」,25 nov. 2017,"y'all everybody's sayin' GMO are safe but wat in the long run super bugs do become so adaptable cos of it, & wat if consuming this food may make us more susceptible to diseases and our immune system won't adapt that fast? Haz anyone made a correlation of drug resistance to GMO? pic.twitter.com/SGz4w5UYN4",0,0,/kwentoka/status/934281643224739840,
43,@FarmFairyCrafts,Farm Fairy Crafts,24 nov. 2017,"Food Can be Medicine or Poison. Your Body, Your Choice.  #GMO pic.twitter.com/Labjd6b2Fi",0,0,/FarmFairyCrafts/status/934128615045894145,
44,@RobertLKruse,"Robert Kruse, PhD",24 nov. 2017,"That @Replicorinc reports their drug has no efficacy in consensus animal models of #HBV (transgenic mice, human liver chimeric mice, woodchuck), but does work in human patients, is confusing to say the least. http://www.sciencedirect.com/science/article/pii/S016635421730596X …",2,5,/RobertLKruse/status/934111004866334720,
45,@zaphraud,an ancient alien,24 nov. 2017,"I'm only objecting to using the simplicity of making, breeding and extracting substance from a GMO as an argument for drug pricing.",0,0,/zaphraud/status/934086921357213696,
46,@ACOSustain,ACOS,24 nov. 2017,"Bayer’s lymphoma drug, Aliqopa, causes hyperglycemia in > 50% of pts. GMO Industry benefits. #Insulin #cancer http://www.investor.bayer.de/en/nc/news/investor-news/investor-news/bayer-receives-fda-approval-for-copanlisib-in-adults-with-relapsed-follicular-lymphoma-after-two-pri/ …pic.twitter.com/mrTLG9dyTz",0,1,/ACOSustain/status/934034479714308096,
47,@theitskeptic,Rob England,24 nov. 2017,"If you insist on government following scientific consensus when deciding on climate policy, you must also do the same for medicine, health, food, GMO, vaccines...",1,3,/theitskeptic/status/933994865213415424,
48,@quietlycurious,❔Quietly Curious Ⓥ,23 nov. 2017,"Natural as in eating whole foods that aren't corrupted by pesticides &/or genetic modification (gmo) instead of processed foods. As in integrating Eastern w/ Western medicine.
Then there are those like .@CharlieGoldsmith who uses energy healing. It is amazing to see.",0,1,/quietlycurious/status/933505692433920000,
49,@GStoneSociety,Greenstone Society,22 nov. 2017,"We have some fire prerolls in stock! 
Grab #GMO, #Shipwreck, #KosherDawg, #GoldenGoat, and a few more of your favorites. > https://greenstonesociety.com/menu/  #AnnArbor #Cannabis #Medicine #Preroll #Marijuanapic.twitter.com/87fdyXG4f4",1,2,/GStoneSociety/status/933477775125680128,
50,@lenrosen4,Len Rosen,22 nov. 2017,"GMO news: GMO salmon, preventing crop failures, & precision medicine. #21stcentech | http://www.21stcentech.com/gmo-headlines-week/ …pic.twitter.com/rYRaKBaFr7",0,0,/lenrosen4/status/933445686691008518,
51,@GElsacker,GUY VAN ELSACKER,22 nov. 2017,NO - this has nothing to do with genetic manipulation. This is only a scientific interaction to support repair and maintain your genes. It has nothing to do with medicine or GMO.,0,0,/GElsacker/status/933420270639112197,
52,@GStoneSociety,Greenstone Society,22 nov. 2017,"That feeling when you find out #GMO is on special. 
Pick it up at these donation levels: $135 per 1/2 oz. and $235 per 1 oz. #AnnArbor #Cannabis #Medicine #Mmmp #GarlicCookies #Marijuanapic.twitter.com/Bz2oPkcC4A",0,1,/GStoneSociety/status/933403390696189952,
53,@delanat95,nathal!a,22 nov. 2017,LSD is a psychoactive drug that expands and opens parts of your brain.. in a world where fluoride /GMO n other harsh chemicals  that interfere with our way of being/thinking I personally think it makes people more aware and openminded.. can be abused though https://twitter.com/b_riiitttt/status/933383472424607744 …,2,22,/delanat95/status/933386249003352064,
54,@ArbitraryDesign,Arbitrary Design,22 nov. 2017,"Gelderloos:  “Some people destroy fields of genetically modified crops owned by companies seeking to patent life itself, some indigenous communities keep out anthropologists, biologists and other researches trying to catalogue and patent their traditional music, folk medicine,...",0,0,/ArbitraryDesign/status/933369578461151233,
55,@BioinfoTools,Grant Jacobs,22 nov. 2017,"What do you think of gene therapy and gene enhancement? 
https://sciblogs.co.nz/code-for-life/2017/11/21/public-opinion-gene-editing-enhancement/ …
#GeneEditing #GeneTherapy #Enhancement #FutureMan #medicine #GMO",0,1,/BioinfoTools/status/933124928500404225,
56,@Sheeple101,Sheeple101,21 nov. 2017,This seems to be the norm now. In medicine and GMO as well. Trust the REP that's just a salesperson that only knows what they are told to say with their own twist.,2,3,/Sheeple101/status/932981105476513793,
57,@pandamoonpub,Pandamoon Publishing,21 nov. 2017,Bad-ass DEA Shyla & Genetically Modified super human fight drug lord in #paranormal #thriller ROGUE ALLIANCE by Michelle Bellon @MichelleBellon. Available in eBook and Print at Amazon. Kindle Unlimited Members Read it for #FREE. Get it now in the US athttp://amzn.to/2sJuddN,4,0,/pandamoonpub/status/932898658470809600,
58,@911bodysnatcher,M Chris Neglia,21 nov. 2017,"The only reason why we should do that is to degrade the Clinton-NATO Drug Network.  And of course that we have poppy programs starting the the US for pharma, or the commercialization of GMO opiate making bacteria has reached a practical stage",0,1,/911bodysnatcher/status/932837465190289408,
59,@linwonderbarr,Lynagre,21 nov. 2017,"@realDonaldTrump Could you please stop Monsanto from poisoning all of us. Label GMO's, We have enuf with chemtrails spraying us like roaches...hint nothing to do with climate change. Look favorably at Altenative Medicine healthcare please.",0,0,/linwonderbarr/status/932826253987520512,
60,@WHS_BiologyDept,WHS Biology Dept,20 nov. 2017,"S1 role played Research Scientists, Doctors, RSPCA Officers, Patients and even Goats to debate the use of transgenic animals to produce medicine... pic.twitter.com/NJF3RhSIJ7",2,3,/WHS_BiologyDept/status/932739889661169665,
61,@Evo_Explorer,John S. Mead,20 nov. 2017,"New and Updated Resources from
 @BIOINTERACTIVE  November 16, 2017 — Includes info about GMO mosquitos, Genes for Reneration, Population Dynamics & genetic medicine - amomng other things  |http://www.hhmi.org/biointeractive/blog/new-and-updated-resources-november-16-2017#.WhNBOe0grSY.twitter …",5,9,/Evo_Explorer/status/932714667587366917,
62,@twitevit,Tom Andersen,20 nov. 2017,Huge difference in which #risks one accepts by #medical treatment during #Illness & risks connected to daily #Food  #GMO based #medicine is produced in closed reactors - no #environmental impact,0,0,/twitevit/status/932645430621605888,
63,@SciSeeker,ScienceSeeker,20 nov. 2017,"Transgenic stem cells lead to a miraculous cure by @StevenSalzberg1 at Genomics, Medicine, and Pseudoscience http://bit.ly/2jaZbUz  7-year-old boy suffering from a genetic disease is saved with transgenic stem cells #sciseekpicks",0,1,/SciSeeker/status/932629939794468864,
64,@backwoodsy101,brenda wilson (moll),20 nov. 2017,"feeding the poor w gmo poison,helping them2modern medical tests+medicine,IS collective murder.as is ignoring stopping the toxin makers!our cuntry protected them+then said ok release it on us?!",0,0,/backwoodsy101/status/932604545489887232,
65,@Leilani85,Leilani Deem,20 nov. 2017,"Want a fresh, pasture-raised organic turkey for the holidays? A turkey raised ethically and humanely? Uncontaminated with drug residues, and not fed GMO feed? Check this out #boycottfactoryfarmshttps://twitter.com/OrganicConsumer/status/931281820158541824 …",0,0,/Leilani85/status/932403822680596481,
66,@HIV_AIDS_Bio,HIV/AIDS News,19 nov. 2017,Evaluation of immunemediated idiosyncratic drug toxicity using chimeric HLA transgenic mice.: Immunemediated… http://bioportfol.io/Q1pGrd pic.twitter.com/otlaUMu97C,0,0,/HIV_AIDS_Bio/status/932330978395095040,
67,@PositivelyJoan,Positively Joan,19 nov. 2017,"You don't wanna know! Injected rotten fake & oth unhealthy fat? sugars, bad quality salt? toxic preservatives colors artificial what-nots? hormones? antibiotics? any chemical drug etc to entice consumers? & that was going on even before decades of forced #Monsanto #GMO pandemic",4,3,/PositivelyJoan/status/932062887622987778,
68,@FoodSovereignGH,FoodSovereigntyGhana,18 nov. 2017,3c. – USA: Food and Drug Administration (FDA): GMO Seralini http://www.gmoseralini.org/fda/,1,0,/FoodSovereignGH/status/931935187604267010,
69,@jamesPJordan777,James P Jordan,18 nov. 2017,"When will you review grade 4 science and realize you breath CO2?! CO2 is not the problem it’s ESSENTIAL to life. Chemicals drug resins  and pollutions GMO’s KILL, yet you support them and push to tax air we breath ?!",0,0,/jamesPJordan777/status/931706118237175808,
70,@gmo_vidal,Guillermo Vidal A.,17 nov. 2017,Believe me that nothing would please me more... and a country as beautiful as  can not be undied under the drug.,0,0,/gmo_vidal/status/931609142988386304,
71,@FlawsinFinesser,Flawsin The Finesser,16 nov. 2017,Now that is something i believe specifically for dispensaries. I know that shit gmo. Support your local drug dealer,0,1,/FlawsinFinesser/status/931211577654685697,
72,@PasteurKorea,Institut Pasteur ROK,16 nov. 2017,"[IPK Seminar] by Prof. Simon Weonsang Ro, Yonsei University College of Medicine, Korea, on Development and application of transgenic mouse models for liver fibrosis and cancer https://goo.gl/Anwdyb pic.twitter.com/7Grhh936DN",0,1,/PasteurKorea/status/931089369858957313,
73,@onecrazychief,Fire Chief   📢,16 nov. 2017,"So, what if #GMO's (in our food) could introduce RNA interference technology into the body & modify our existing #DNA?  
#genes #genetics #Monsanto #science #hacking #biohacking #RNAi #Biology #Medicine #Food #OrganicFood #Farming
http://www.collective-evolution.com/2017/11/09/the-gmo-agenda-takes-a-menacing-leap-forward-with-epas-silent-approval-of-monsantodows-rnai-corn/ …https://twitter.com/defcon/status/931030067156865024 …",1,1,/onecrazychief/status/931064819838361600,
74,@WorldTruthTV,WorldTruth.TV,16 nov. 2017,Genetically Modified Humans? New Gene-Altering Drug Paves Way For Mass Modification http://fb.me/4ekCIEGby,0,0,/WorldTruthTV/status/931019055384944640,
75,@CascadiaVF,Cascadia-VF,16 nov. 2017,Increasing the efficiency and lowering the expense of drug development with genetically modified nematodes @nemametrix #cvfsummit #cascadiavfpic.twitter.com/fdCdSTJ5ki,3,5,/CascadiaVF/status/930950858488999937,
76,@pillsandpebbles,Pills & Pebbles,15 nov. 2017,"Getting sick has opened up my eyes to,
-  How poisoned our food supply is (#Monsanto, #Glyphosate, #GMO), 
- Our medicine is often just patented bandaids (#bigpharma) 
- How lack of healthcare occurs due to lobbyists/corruption, at the cost of human life (#medicare4all).",7,9,/pillsandpebbles/status/930929300135727104,
77,@non_gmo_organic,Non GMO Organics,15 nov. 2017,Agarikon: Ancient #Mushroom for Modern Medicine · Low Carb Living · Disqus http://ow.ly/EKby30gBIe1,0,0,/non_gmo_organic/status/930921556989136896,
78,@CkitOutPassitON,StuffUNeedToKnow,15 nov. 2017,"This Merger Must Be Stopped! Call Your DC Reps
Million Plus Consumers and Farmers Petition DOJ
To Block Bayer Monsanto Merger - Chemicals and Medicine A Dangerous Combo!
#BigPharma #GMO #Glyphosate #Organic #Gardening #Farming #Health #Fitness
#Cannabis #Hemp #infosechttps://twitter.com/BaitandSketch/status/930875184449499137 …",4,10,/CkitOutPassitON/status/930891220901011456,
79,@DrThomasPaul,"Dr. Thomas Paul, Therapist. #MindBody",15 nov. 2017,"""Drug companies are in the business of convincing more and more #HEALTHY people they need prescription #drugs for life."" 
#BigPharma #gmo #VAXXED #MSMhttps://www.naturalnews.com/2017-11-15-pharma-drug-cartel-just-changed-the-definition-of-high-blood-pressure.html …",20,19,/DrThomasPaul/status/930889886873174017,
80,@Terry24681865,Terry,15 nov. 2017,"@HealthCanada The truth about this Flower of Life should be setting us free, instead mafia with a badge and their politician friends get to GMO and Poison our medicine just like they ruined Cigarettes except Cannabis has over 700 medical uses. Shame! #cdnpoli #abpoli #bcpoli",0,3,/Terry24681865/status/930869928332316678,
81,@RealNewsWars,Real #NewsWars  🔮,15 nov. 2017,"... Real #NewsWars.live: #America is saturated with: #entertainment, #talkshows, #sports, #sexualization, #GMO foods, drug #addictions of all kinds legal/non-legal, #satanic symbolism, threat of #WW3, #debt, living
paycheck to paycheck, & constant threat of #terrorattacks.pic.twitter.com/76d5R5O9fd",1,0,/RealNewsWars/status/930813348253401088,
